_id,disease_korean_title,related_diseases,diseases_symptoms,cause_diseases
65dc4b75da45daab46acd7d4,고밀도침착병을 동반한 신증후군,"유전자 돌연변이에 의한 신증후군\n(Genetic Nephrotic syndrome, medication-resistant)\n소사구체이상을 동반한 신증후군\n최소변화병변을 동반한 신증후군\n초점성 및 분절성 사구체병변을 동반한 신증후군\n초점성 및 분절성 유리질증을 동반한 신증후군\n초점성 및 분절성 경화증을 동반한 신증후군\n초점성 사구체신염을 동반한 신증후군\n미만성 막성 사구체신염을 동반한 신증후군\n미만성 메산지음 증식성 사구체신염을 동반한 신증후군\n미만성 모세혈관내 증식성 사구체신염을 동반한 신증후군\n미만성 메산지음 모세혈관성 사구체신염을 동반한 신증후군\n막증식성 사구체신염, 1형, 3형 또는NOS를 동반한 신증후군\n고밀도침착병을 동반한 신증후군\n막증식성 사구체신염, 2형을 동반한 신증후군\n미만성 반월형 사구체신염을 동반한 신증후군\n모세혈관외 사구체신염을 동반한 신증후군",단백뇨. 그 외 동반침범 부위와 연관된 증상,유전인자와 환경인자의 상호작용
65dc4b77da45daab46acd7d6,고밀도침착병을 동반한 신증후군,"유전자 돌연변이에 의한 신증후군\n(Genetic Nephrotic syndrome, medication-resistant)\n소사구체이상을 동반한 신증후군\n최소변화병변을 동반한 신증후군\n초점성 및 분절성 사구체병변을 동반한 신증후군\n초점성 및 분절성 유리질증을 동반한 신증후군\n초점성 및 분절성 경화증을 동반한 신증후군\n초점성 사구체신염을 동반한 신증후군\n미만성 막성 사구체신염을 동반한 신증후군\n미만성 메산지음 증식성 사구체신염을 동반한 신증후군\n미만성 모세혈관내 증식성 사구체신염을 동반한 신증후군\n미만성 메산지음 모세혈관성 사구체신염을 동반한 신증후군\n막증식성 사구체신염, 1형, 3형 또는NOS를 동반한 신증후군\n고밀도침착병을 동반한 신증후군\n막증식성 사구체신염, 2형을 동반한 신증후군\n미만성 반월형 사구체신염을 동반한 신증후군\n모세혈관외 사구체신염을 동반한 신증후군",단백뇨. 그 외 동반침범 부위와 연관된 증상,유전인자와 환경인자의 상호작용
65dc4b7ada45daab46acd7d8,고밀도침착병을 동반한 신증후군,"유전자 돌연변이에 의한 신증후군\n(Genetic Nephrotic syndrome, medication-resistant)\n소사구체이상을 동반한 신증후군\n최소변화병변을 동반한 신증후군\n초점성 및 분절성 사구체병변을 동반한 신증후군\n초점성 및 분절성 유리질증을 동반한 신증후군\n초점성 및 분절성 경화증을 동반한 신증후군\n초점성 사구체신염을 동반한 신증후군\n미만성 막성 사구체신염을 동반한 신증후군\n미만성 메산지음 증식성 사구체신염을 동반한 신증후군\n미만성 모세혈관내 증식성 사구체신염을 동반한 신증후군\n미만성 메산지음 모세혈관성 사구체신염을 동반한 신증후군\n막증식성 사구체신염, 1형, 3형 또는NOS를 동반한 신증후군\n고밀도침착병을 동반한 신증후군\n막증식성 사구체신염, 2형을 동반한 신증후군\n미만성 반월형 사구체신염을 동반한 신증후군\n모세혈관외 사구체신염을 동반한 신증후군",단백뇨. 그 외 동반침범 부위와 연관된 증상,유전인자와 환경인자의 상호작용
65dc4b7cda45daab46acd7da,고밀도침착병을 동반한 신증후군,"유전자 돌연변이에 의한 신증후군\n(Genetic Nephrotic syndrome, medication-resistant)\n소사구체이상을 동반한 신증후군\n최소변화병변을 동반한 신증후군\n초점성 및 분절성 사구체병변을 동반한 신증후군\n초점성 및 분절성 유리질증을 동반한 신증후군\n초점성 및 분절성 경화증을 동반한 신증후군\n초점성 사구체신염을 동반한 신증후군\n미만성 막성 사구체신염을 동반한 신증후군\n미만성 메산지음 증식성 사구체신염을 동반한 신증후군\n미만성 모세혈관내 증식성 사구체신염을 동반한 신증후군\n미만성 메산지음 모세혈관성 사구체신염을 동반한 신증후군\n막증식성 사구체신염, 1형, 3형 또는NOS를 동반한 신증후군\n고밀도침착병을 동반한 신증후군\n막증식성 사구체신염, 2형을 동반한 신증후군\n미만성 반월형 사구체신염을 동반한 신증후군\n모세혈관외 사구체신염을 동반한 신증후군",단백뇨. 그 외 동반침범 부위와 연관된 증상,유전인자와 환경인자의 상호작용
65dc4b7eda45daab46acd7dc,고밀도침착병을 동반한 신증후군,"유전자 돌연변이에 의한 신증후군\n(Genetic Nephrotic syndrome, medication-resistant)\n소사구체이상을 동반한 신증후군\n최소변화병변을 동반한 신증후군\n초점성 및 분절성 사구체병변을 동반한 신증후군\n초점성 및 분절성 유리질증을 동반한 신증후군\n초점성 및 분절성 경화증을 동반한 신증후군\n초점성 사구체신염을 동반한 신증후군\n미만성 막성 사구체신염을 동반한 신증후군\n미만성 메산지음 증식성 사구체신염을 동반한 신증후군\n미만성 모세혈관내 증식성 사구체신염을 동반한 신증후군\n미만성 메산지음 모세혈관성 사구체신염을 동반한 신증후군\n막증식성 사구체신염, 1형, 3형 또는NOS를 동반한 신증후군\n고밀도침착병을 동반한 신증후군\n막증식성 사구체신염, 2형을 동반한 신증후군\n미만성 반월형 사구체신염을 동반한 신증후군\n모세혈관외 사구체신염을 동반한 신증후군",단백뇨. 그 외 동반침범 부위와 연관된 증상,유전인자와 환경인자의 상호작용
65dc4b81da45daab46acd7de,고밀도침착병을 동반한 신증후군,"유전자 돌연변이에 의한 신증후군\n(Genetic Nephrotic syndrome, medication-resistant)\n소사구체이상을 동반한 신증후군\n최소변화병변을 동반한 신증후군\n초점성 및 분절성 사구체병변을 동반한 신증후군\n초점성 및 분절성 유리질증을 동반한 신증후군\n초점성 및 분절성 경화증을 동반한 신증후군\n초점성 사구체신염을 동반한 신증후군\n미만성 막성 사구체신염을 동반한 신증후군\n미만성 메산지음 증식성 사구체신염을 동반한 신증후군\n미만성 모세혈관내 증식성 사구체신염을 동반한 신증후군\n미만성 메산지음 모세혈관성 사구체신염을 동반한 신증후군\n막증식성 사구체신염, 1형, 3형 또는NOS를 동반한 신증후군\n고밀도침착병을 동반한 신증후군\n막증식성 사구체신염, 2형을 동반한 신증후군\n미만성 반월형 사구체신염을 동반한 신증후군\n모세혈관외 사구체신염을 동반한 신증후군",단백뇨. 그 외 동반침범 부위와 연관된 증상,유전인자와 환경인자의 상호작용
65dc4b83da45daab46acd7e0,고밀도침착병을 동반한 신증후군,"유전자 돌연변이에 의한 신증후군\n(Genetic Nephrotic syndrome, medication-resistant)\n소사구체이상을 동반한 신증후군\n최소변화병변을 동반한 신증후군\n초점성 및 분절성 사구체병변을 동반한 신증후군\n초점성 및 분절성 유리질증을 동반한 신증후군\n초점성 및 분절성 경화증을 동반한 신증후군\n초점성 사구체신염을 동반한 신증후군\n미만성 막성 사구체신염을 동반한 신증후군\n미만성 메산지음 증식성 사구체신염을 동반한 신증후군\n미만성 모세혈관내 증식성 사구체신염을 동반한 신증후군\n미만성 메산지음 모세혈관성 사구체신염을 동반한 신증후군\n막증식성 사구체신염, 1형, 3형 또는NOS를 동반한 신증후군\n고밀도침착병을 동반한 신증후군\n막증식성 사구체신염, 2형을 동반한 신증후군\n미만성 반월형 사구체신염을 동반한 신증후군\n모세혈관외 사구체신염을 동반한 신증후군",단백뇨. 그 외 동반침범 부위와 연관된 증상,유전인자와 환경인자의 상호작용
65dc4b85da45daab46acd7e2,고밀도침착병을 동반한 신증후군,"유전자 돌연변이에 의한 신증후군\n(Genetic Nephrotic syndrome, medication-resistant)\n소사구체이상을 동반한 신증후군\n최소변화병변을 동반한 신증후군\n초점성 및 분절성 사구체병변을 동반한 신증후군\n초점성 및 분절성 유리질증을 동반한 신증후군\n초점성 및 분절성 경화증을 동반한 신증후군\n초점성 사구체신염을 동반한 신증후군\n미만성 막성 사구체신염을 동반한 신증후군\n미만성 메산지음 증식성 사구체신염을 동반한 신증후군\n미만성 모세혈관내 증식성 사구체신염을 동반한 신증후군\n미만성 메산지음 모세혈관성 사구체신염을 동반한 신증후군\n막증식성 사구체신염, 1형, 3형 또는NOS를 동반한 신증후군\n고밀도침착병을 동반한 신증후군\n막증식성 사구체신염, 2형을 동반한 신증후군\n미만성 반월형 사구체신염을 동반한 신증후군\n모세혈관외 사구체신염을 동반한 신증후군",단백뇨. 그 외 동반침범 부위와 연관된 증상,유전인자와 환경인자의 상호작용
65dc4b88da45daab46acd7e4,고밀도침착병을 동반한 신증후군,"유전자 돌연변이에 의한 신증후군\n(Genetic Nephrotic syndrome, medication-resistant)\n소사구체이상을 동반한 신증후군\n최소변화병변을 동반한 신증후군\n초점성 및 분절성 사구체병변을 동반한 신증후군\n초점성 및 분절성 유리질증을 동반한 신증후군\n초점성 및 분절성 경화증을 동반한 신증후군\n초점성 사구체신염을 동반한 신증후군\n미만성 막성 사구체신염을 동반한 신증후군\n미만성 메산지음 증식성 사구체신염을 동반한 신증후군\n미만성 모세혈관내 증식성 사구체신염을 동반한 신증후군\n미만성 메산지음 모세혈관성 사구체신염을 동반한 신증후군\n막증식성 사구체신염, 1형, 3형 또는NOS를 동반한 신증후군\n고밀도침착병을 동반한 신증후군\n막증식성 사구체신염, 2형을 동반한 신증후군\n미만성 반월형 사구체신염을 동반한 신증후군\n모세혈관외 사구체신염을 동반한 신증후군",단백뇨. 그 외 동반침범 부위와 연관된 증상,유전인자와 환경인자의 상호작용
65dc4b8dda45daab46acd7e6,재발성 다발연골염,만성 위축성 다발연골염\n(Chronic Atrophic Polychondritis)\n전신성 연골연화증\n(Generalized or Systemic Chondromalocia)\n재발성 연골막염\n(Meyenburg-Altherr-Uehlinger Syndrome),"대동맥 판막에 영향을 받을 수 있음, 신장의 염증, 코의 연골염",정확한 원인은 알려지지 않았으나 자가면역질환으로 추정
65dc4b8fda45daab46acd7e8,성인의 킨뵉병,키엔벡병\n(Kienbocks disease)\n손목 월상골의 무혈성 괴사\n(avascular necrosis of the lunate)\nOsteocronosis of the lunate,손목의 만성 통증과 기능 부전,염증이나 외상 등이 선행요인으로 추정됨
65dc4b91da45daab46acd7ea,수근반달뼈의 골연골증(연소성)[킨뵉],Kienbock's disease,"손목의 통증과 붓기, 손목 운동 범위의 제한, 뻣뻣함, 압통, 악력의 약화","미상, 반달뼈 혈액공급의 중단으로 인한 뼈괴사 (osteonecrosis)"
65dc4b94da45daab46acd7ec,상세불명의 뼈의 파젯병,변형성 골염\n뼈의 파젯병,"침범된 부위의 통증. 관절염, 뼈의 약화 골절 및 변형. 청력상실",미상
65dc4b96da45daab46acd7ee,기타 뼈의 파젯병,변형성 골염\n뼈의 파젯병,"침범된 부위의 통증. 관절염, 뼈의 약화 골절 및 변형.",유전과 환경인자가 상호 작용하여 발생하는 것으로 추정됨.
65dc4b99da45daab46acd7f0,두개골의 파젯병,변형성 골염\n뼈의 파젯병,"머리뼈의 과대 성장, 두개골 골절, 청력감소, 진행성 두통",유전과 환경인자가 상호 작용하여 발생하는 것으로 추정됨.
65dc4b9bda45daab46acd7f2,진행성 골화섬유형성이상,골화 섬유이형성증\n(fibrodysplasia ossificans)\n진행성 골화성 근염\n(myositis ossificans progressiva),"사지 관절 운동 장애, 수족지의 기형, 심폐 기능 장애, 재발성 종괴, 척추 운동 장애, 척추 측만증",ACVR1 유전자 돌연변이
65dc4b9dda45daab46acd7f4,재발성 지방층염[웨버-크리스찬],"결절상비화농성 피하지방층염\n(Nodular Nonsuppurative Panniculitis)\n파이퍼-웨버-크리스찬 증후군\n(Pfeiffer-Weber-Christian syndrome)\n재발성 열성 결절성 비화농성 지방질염\n(Relapsing Febrile Nodular Nonsuppurative Panniculitis)\n웨버 크리스찬 병\n(Weber-Christian Disease)\n특발성 결절성 지방층염\n(Panniculitis, Idiopathic Nodular)","근육통, 발열, 복통, 피로감, 피하 결절",정확한 원인은 알려지지 않았지만 재발성 지방층염과 관련된 다양한 원인들이 제시
65dc4ba0da45daab46acd7f6,다초점 섬유경화증,IgG4-related disease\nIdiopathic fibrosclerosis,"다양한 장기의 증상을 나타낼 수 있으며, 발작, 신경마비, 시력상실, 심폐기능 이상, 장폐색, 신기능 이상등을 초래할 수 있다.","침범된 장기에 IgG4 가 축적되면서 염증을 야기하며, 야기된 염증에 의해 결합조직이 축적되어 섬유화가 진행되어 침범된 장기의 기능에 영향을 준다."
65dc4ba2da45daab46acd7f8,미만성(호산구성) 근막염,호산구 증후군\n(Eosinophia Syndrome)\n호산성 증후군\n(Eosinophlic Syndrome)\n호산구증\n(Eosinophilia),"통증, 피부의 염증과 부종, 손목굴증후군(수근관 증후군)","(정확한 원인은 알려지지 않았음 ) 피부경화증(Scleroderma)의 다른 형태, 자가면역질환의 일종, L-트립토판 자체가 증상을 유발시킬 가능성이 있다고 보고되었음."
65dc4ba7da45daab46acd7fa,류마티스성 다발근통,류마티스(성) 다발성 근육통\n(Polymyalgia rheumatica)\n관절염성 증후군\n(Anarthritic Syndrome)\n관절염성 류마티스 병\n(Arthritic Rheumatoid Disease)\n거대세포 동맥염\n(Giant cell arteritis),"근육통, 류마티스 관절염과 비슷한 증상",정확한 원인은 알려지지 않았으나 자가 면역 질환으로 추정
65dc4ba9da45daab46acd7fc,베체트병,베체트 증후군\n(Behcet’s Syndrome)\n아다만티아데스-배채트 증후군\n(Adamantiades-Behcet’s Syndrome)\n베체트 병\n(BD)\n후루시-베체트 증후군\n(Hulusi-Behcet’s Syndrome)\n눈-볼-생식기 증후군\n(Oculo-Bucco-Genital Syndrome)\n투렌 아프타증\n(Touraine’s Aphthosis)\n베체트 삼중 복합 증후군\n(Triple Symptom Complex of Behcet),"구강 궤양, 눈의 염증, 음부 궤양, 피부병변","정확한 병인은 알려지지 않았으나, 유전적 소인, 면역이상, 감염 등 복합적인 요인으로 추측되어지고 있으며, 최근 자가염증질환 ( autoinflammation)의 하나로도 분류됨"
65dc4bacda45daab46acd7fe,혼합결합조직병,결합조직질환\n(Connective Tissue Disease)\n혼합성 결합조직 질환\n(MCTD),"관절의 염증, 근육쇠약, 레이노 현상(Raynauds Phenimenon), 식도의 기능 이상, 신장ㆍ신경ㆍ심장ㆍ호흡기계",정확한 원인은 알려지지 않았으나 유전적인 요인과 환경적인 요인이 복합적으로 작용
65dc4baeda45daab46acd800,각막결막염을(를) 동반한 쉐그렌증후군,건조증후군\n(Sicca Syndrome )\n건성각결막염\n( Keratoconjunctivitis Sicca)\n쉐그렌 증후군,"안구 건조, 입마름, 치아 우식증",자가면역질환
65dc4bb0da45daab46acd802,건조증후군[쉐그렌],눈물침샘병증 위축\n(Dacryosialoadenopathia atrophicans)\n구제로 - 휴우- 쉐그렌\n(Gougerot-Houwer-Sjogren)\n구제로 쉐그렌(쇼그렌)\n(Gougerot-Sjogren)\n건성각결막염\n(Keratoconjunctivitis Sicca)\n건성각결막염-구강건조증\n(Keratoconjunctivitis sicca-xerostomia)\n분비-억제성-피부건조협착증\n(Secreto-inhibitor-xerodermostenosis)\n건조증후군\n(Sicca Syndrome),"관절염, 구강 건조증, 안구건조증, 피부가 건조해짐, 혈관염","정확한 원인은 모름(유전적인 요인과 환경적인 요인이 복합적으로 작용하여 발생되며, 자가면역질환으로 추정됨)"
65dc4bb3da45daab46acd804,신세뇨관-간질성 장애을(를) 동반한 쉐그렌증후군,건조증후군\n(Sicca Syndrome )\n건성각결막염\n( Keratoconjunctivitis Sicca)\n쉐그렌 증후군,"안구 건조, 입마름, 치아 우식증, 무증상, 혈뇨, 단백뇨, 신장 결석",자가면역질환
65dc4bb5da45daab46acd806,근병증을(를) 동반한 쉐그렌증후군,건조증후군\n(Sicca Syndrome )\n건성각결막염\n( Keratoconjunctivitis Sicca )\n염증성 근병증\n( Inflammatory myopathy)\n쉐그렌 증후군,"안구 건조, 입마름, 치아 우식증, 근력저하",자가면역질환
65dc4bb8da45daab46acd808,폐침범을(를) 동반한 쉐그렌증후군,건조증후군\n(Sicca Syndrome )\n건성각결막염\n( Keratoconjunctivitis Sicca )\n염증성 근병증\n( Inflammatory myopathy)\n쉐그렌 증후군,"안구 건조, 입마름, 치아 우식증, 기침, 호흡곤란, 가래",자가면역질환
65dc4bbada45daab46acd80a,근병증을 동반한 전신경화증,Scleroderma,"레이노 현상, 피부 경화, 관절 증상, 소화기능 장애, 폐섬유화",자가면역질환
65dc4bbcda45daab46acd80c,근병증을 동반한 전신경화증,Scleroderma,"레이노 현상, 피부 경화, 관절 증상, 소화기능 장애, 폐섬유화",자가면역질환
65dc4bc2da45daab46acd80e,"석회증, 레이노현상, 식도기능장애, 경지증(硬指症), 모세혈관확장의 조합",경피증\n진행성 전신경화증,"피부가 단단하고 두꺼워짐, 손가락, 발가락이 부음, 관절통 및 관절 경직","작은 혈관의 이상, 섬유화, 자가면역과 함께 면역 체계의 활성화"
65dc4bc4da45daab46acd810,"석회증, 레이노현상, 식도기능장애, 경지증(硬指症), 모세혈관확장의 조합",경피증\n진행성 전신경화증,"피부가 단단하고 두꺼워짐, 손가락, 발가락이 부음, 관절통 및 관절 경직","작은 혈관의 이상, 섬유화, 자가면역과 함께 면역 체계의 활성화"
65dc4bc7da45daab46acd812,근병증을 동반한 전신경화증,Scleroderma,"레이노 현상, 피부 경화, 관절 증상, 소화기능 장애, 폐섬유화",자가면역질환
65dc4bc9da45daab46acd814,다발근염,다발성근육염 또는 다발근육염\n(Polymyositis)\n일차특발성 다발성근육염\n(Primary Idiopathic Polymyositis)\n소아 다발성근육염\n(Childhood Polymyositis)\n악성종양관련 다발성근육염\n(Polymyositis Associated with Malignant Tumors )\n경피성 피부근염관련 다발성근육염\n(Polymyositis Associated with Sclerodermatomyositis)\n혼합결합조직병관련 다발성근육염\n(Polymyositis Associated with Mixed Connective Tissue Disease (Overlap Syn)),"근무력, 레이노 현상(Raynaud`s phenomenon), 소화기계의 궤양, 심장 박동 불규칙, 폐의 염증, 흉부근육이 약해","정확한 원인은 알려지지 않았으나 자가면역반응 추측, 콜라겐의 주사"
65dc4bcbda45daab46acd816,기타 피부근염,"특발성 염증성 근육병증\n(Idiopathic inflammatory myopathy, IIM)\n피부근육염\n(Dermatomyositis, DM)\n성인 피부근염\n(Adult dermatomyositits, ADM)\n무근육병피부근육염\n(Amyopathic DM)\n소아기 피부근염\n(Juvenile (Childhood) dermatomyositis (JDMS))\n다발근육염\n(Polymyositis, PM)","대칭적 근위부 근육 쇠약 및 위축, 부종과 홍반을 동반한 피부병변 (고트론 구진/징후)","정확한 원인은 알려지지 않았으나, 유전으로 감수성이 있는 사람에게 외부의 환경적 요인의 자극에 의해 유발된 면역학적 기전에 의해 유발된다고 알려짐"
65dc4bceda45daab46acd818,연소성 피부근염,소아기 피부근염\n(Juvenile dermatomyositis )\n소아기 다발성근염\n( Juvenile polymyositis),"중심부 근육의 대칭적 위약, 안검의 특징적 착색 및 부종, 관절(손가락 마디, 팔꿈치, 무릎, 발목 등) 신전부의 구진성 홍반, 전신 피로감",자가면역질환
65dc4bd0da45daab46acd81a,전신홍반루푸스에서의 대뇌동맥염,루푸스 혈관염\n(Lupus vasculitis)\n전신홍반루푸스에서의 혈관염\n(Vasculitis in SLE),"무증상 상태에서 뇌영상검사에서 발견되기도 하고 편마비, 언어장애, 의식저하와 같은 뇌졸중의 증상이 나타나기도 합니다.",전신홍반루푸스의 원인이 되는 염증 반응이 대뇌동맥혈관에 발생하는 자가면역질환
65dc4bd3da45daab46acd81c,폐침범 동반 전신홍반루푸스,lupus pneumonitis\nSLE interstitial lung disease\nSLE pleuritis\nSLE pulmonary hemorrage\nSLE pulmonary thrombo-embolism\nacute lupus pneumonitis\nshrinking lung syndrome,"기침, 숨참, 호흡곤란, 흉통, 흉막염, 폐렴, 객혈 등의 호흡기 증상",루푸스 폐질환은 전신홍반루푸스의 원인이 되는 염증 반응이 폐에 발생하는 자가면역질환입니다.
65dc4bd5da45daab46acd81e,리브만-삭스병,감염성 심내막염\n(Infective endocarditis)\n류마티스성 판막 질환\n(Rheumatic valvular disease)\n심방 점액종\n(Atrial myxoma)\n퇴행성 판막 질환\n(Degenerative valvular disease),"심장 판막의 경화, 판막 역류 및 판막이 두꺼워지는 현상, 심내막염, 판막 역류에 의한 호흡곤란","감염의 증거 없이 무균성의 우종(vegetation)에 의한 심내막의 염증반응과 혈관의 증식, 악성종양, 전신홍반루푸스, 항인지질증후군 등과 연관"
65dc4bd7da45daab46acd820,세뇨관-간질신장병증 동반 전신홍반루푸스,신장 침범을 동반한 전신홍반루푸스\n(systemic lupus erythematousus with kidney involvement),"루푸스 세뇨관-간질 신염의 임상 증상은 일반적인 신장 질환의 증상과 구별하기 어려우며, 혈뇨, 단백뇨, 다리 부종, 고혈압, 혈중 크레아티닌 상승",루푸스 세뇨관-간질 신염은 전신홍반루푸스의 원인이 되는 면역복합체가 신장에 침착되어 발생하는 자가면역질환
65dc4bdcda45daab46acd822,루푸스 심장낭염,기관 또는 계통 침범을 동반한 전신홍반루푸스\n(Systemic lupus erythematosus with organ or system involvement),전신성 홍반성 루푸스의 증상을 보이며 심낭염으로 나타나는 증상,면역 복합체에 의해 매개된 심낭의 염증
65dc4bdeda45daab46acd824,기관 또는 계통 침범을 동반한 전신홍반루푸스,전신성 홍반성 루푸스\n(Systemic lupus erythematosus)\n피부 홍반 루푸스\n(Cutaneous lupus erythematosus),"전신 쇠약감, 피로, 발진, 구강 궤양, 관절 통증, 열, 체중변화, 두통, 탈모, 호흡시 가슴통증, 하지 부종, 레이노 현상","정확한 원인은 알려지지 않았으나 유전적, 면역학적, 환경적 인자 그리고 호르몬의 이상등이 관여하는 것으로 알려져 있다"
65dc4be1da45daab46acd826,신장침범 동반 전신홍반루푸스,전신홍반루푸스 세뇨관-간질 신장염\n(SLE tubulo-interstitial nephritis),"혈뇨, 단백뇨, 다리 부종, 고혈압, 혈중 크레아티닌 상승 등",면역 복합체가 신장에 침착되어 발생하는 자가면역질환
65dc4be3da45daab46acd828,심내막염 동반 전신홍반루푸스,전신홍반루푸스 심장낭염\n(SLE pericarditis)\n전신홍반루푸스 심근염\n(SLE myocarditis)\n심장침범을 동반한 전신홍반루푸스\n(SLE with cardiac involvement),"무증상, 심부전","면역복합체가 심내막, 주로 판막에 침착되어 염증을 일으키는 자가면역질환"
65dc4be6da45daab46acd82a,전신홍반루푸스에서의 근병증,전신홍반루푸스에서의 약물유발 근병증\n(durg-induced myopathy in SLE)\n전신홍반루푸스에서의 섬유근통\n(fibromyalgia in SLE),"근육통, 근력약화, 근위축, 근염",전신홍반루푸스의 원인이 되는 염증 반응이 근육에 발생하는 자가면역질환
65dc4be8da45daab46acd82c,사구체질환 동반 전신홍반루푸스,전신홍반루푸스\n(Systemic lupus erythematosus),"혈뇨, 단백뇨, 부종, 체중증가, 고혈압","정확한 원인은 알려지지 않았으나 유전적, 면역학적, 환경적 인자 그리고 호르몬의 이상 등이 관여하는 것으로 알려져 있습니다."
65dc4beada45daab46acd82e,전신홍반루푸스에서의 뇌염,중추신경계 침범을 동반한 전신홍반루푸스\n(SLE with CNS involvement)\n신경정신병적 전신홍반루푸스\n(Neuropsychiatric systemic lupus erythematosus),"무균성 뇌수막염, 뇌혈관 질환, 탈수초 증후군, 두통, 이상 운동질환, 척수이상, 경련, 급성 의식저하, 불안증, 인지장애, 기분장애 등의 다양한 형태로 나타납니다.",전신홍반루푸스의 원인이 되는 염증 반응이 뇌를 포함한 중추신경계에 발생하는 자가면역질환입니다
