_id,disease_korean_title,related_diseases,diseases_symptoms,cause_diseases
65dc4e4ada45daab46acd9f6,모르키오 (-유사)(고전적) 증후군,없음,"공격적인 행동, 경련, 조화운동불능(Ataxia), 과다행동(Hyperkinetic syndrome), 지적장애, 관절 경축, 탈장(Hernia), 간비장비대(Hepatosplenomegaly), 가슴의 기형, 헐거운 관절, 짧은 목, X형 다리(외반슬: Genu Valgum), 난청, 뇌수종, 대두증, 큰입, 돌출한 광대뼈, 작은 코, 치아 이상, 각막혼탁","상염색체 열성 형질로 유전, A형 16번 염색체의 장완(16q24.3)에 위치하는 GALNS 유전자 변이, B형 3번 염색체의 단완(3p21.33)에 위치하는 GLB1유전자의 변이 - 각 유전자의 변이로 인한 효소 결핍."
65dc4e4dda45daab46acd9f8,마로토-라미 (경도)(중증) 증후군,설파테이스결핍\n(Sulfatase deficiency)\n헐러증후군\n(hurler syndrome),"다발성 뼈발생이상 (dysostosis multiplex), 각막혼탁, 관절구축, 교통성 수두증, 조악한 얼굴모양, 판막형 심질환","상염색체열성유전, ARSB 유전자의 돌연변이로 인한 N-acetylgalactosamine -4-sulfatase (arylsulfatase B) 효소 결핍"
65dc4e4fda45daab46acd9fa,Ⅱ형 점액다당류증,헌터 증후군\n(Hunter Syndrome),"근골격계 변형 및 구축, 얼굴 모양 변형, 청력 및 시각 이상, 수면무호흡증, 잦은 호흡기계 감염, 심근기능장애, 심장판막이상, 수두증",Iduronate 2-sulfatase 결핍
65dc4e52da45daab46acd9fc,헌터증후군,헐러-샤이에증후군\n(hurler-scheie syndrome),"간과 비장이 비대해짐, 독특한 얼굴 생김, 반복되는 요도 감염, 성장 지연, 심장판막 질환, 요족, 점진적 청력기능 소실",X 염색체의 장완(Xq28)에 위치하는 IDS 유전자의 돌연변이로 인한 이두로네이트 2-설파타제 부족에 의한 X 연관 열성 질환
65dc4e54da45daab46acd9fe,샤이에증후군,제 1S형 뮤코 다당증\n(Mucopolysacchariodosis type 1S),"얼굴 모양 변형, 시각 이상, 지능저하, 수면무호흡증, 잦은 호흡기계 감염, 근골격계 질환, 심장판막이상",alpha-L-iduronidase 효소 결핍
65dc4e57da45daab46acda00,Ⅰ형 점액다당류증,"가르고일리즘\n(Gargoylism)\n후를러(헐러) 병\n(Hurler Disease)\n알파-L 이두로니다제 결핍증\n(alpha-L-iduronidase (IDA, IDUA) deficiency)\n제 1형 점액다당질 축적 병\n(mucopolysaccharide storage disease)\n엘리스-쉘던 증후군\n(Ellis-Sheldon syndrome)\n헌터 증후군\n(Hunter syndrome)","특이한 얼굴모양, 서혜부탈장, 성장 지연, 반복되는 상기도 감염(감기), 요도 감염, 만성중이염, 간과 비장이 커짐, 수두증, 배머리증,털과다증, 심장판막 질환, 관상동맥 질환, 고혈압, 부정맥, 폐렴, 척추측만증, 척추후만증, 갈퀴모양손, 손목굴 증후군, 골격이상, 녹내방, 시력 장애, 난청","알파-L 이두로니다제(alpha-L Iduronidase)의 결핍, 상염색체 열성으로 유전"
65dc4e59da45daab46acda02,헐러증후군,제 1H형 뮤코 다당증\n(Mucopolysacchariodosis type 1H),"근골격계 변형 및 구축, 얼굴 모양 변형, 청력 및 시각 이상, 지능저하, 수면무호흡증, 잦은 호흡기계 감염, 심근기능장애, 심장판막이상, 수두증",alpha-L-iduronidase 효소 결핍
65dc4e5cda45daab46acda04,헐러-샤이에증후군,제 1HS형 뮤코 다당증\n(Mucopolysacchariodosis type 1HS),"근골격계 변형 및 구축, 얼굴 모양 변형, 청력 및 시각 이상, 지능저하, 수면무호흡증, 잦은 호흡기계 감염, 심근기능장애, 심장판막이상, 수두증",alpha-L-iduronidase 효소 결핍
65dc4e5eda45daab46acda06,월만병,Cholessteryl ester 축적 질환\n(Cholessteryl ester storage disease)\n리소좀산리파제 결손증\n(Lysosomal acid lipase deficiency)\nCholesterol ester hydrolase deficiency,"간비종대, 성장 부전, 혈액 응고 장애","lysosomal acid lipase의 결핍, 상염색체 열성 유전, 염색체 10q23.2-23.3에 위치하는 LIPA 유전자의 돌연변이"
65dc4e60da45daab46acda08,대뇌건의 콜레스테롤증[밴보게르트-쉐러-엡스타인],가족성 고콜레스테롤혈증\n(familial hypercholesterolemia),"만성설사, 진행성 소뇌 운동실조, 소아 백내장, 치매, 경련, 환각, 우울증, 운동실조, 구음장애","CYP27A1 유전자의 돌연변이로 인한 스테롤27-하이드록시레이즈(sterol 27-hydroxylase)효소의 결핍으로 인한 지질 축적질환, 상염색체 열성유전"
65dc4e65da45daab46acda0a,신경세포세로이드라이포푸스신증,"소아 신경 세로이드 리포푸신증\n(Neuronal Ceroid Lipofuscinosis, Juvenile )\n스필마이어-쇼그렌 병\n(Spielmeyer Sjogren Disease )\n보그트-스필마이어 병\n(Vogt Spielmeyer Disease )\n보그트-스필마이어-쇼그렌 병\n(Vogt Spielmeyer Sjogren Disease )\n얀스키 빌쇼스키병\n(Jansky Bielschowsky Disease )\n쿠프스 병\n(Kufs Disease)","망막색소변성과 시신경위축, 발작, 시력소실, 인격변화, 진행성 신경성 퇴행, 황반변성",CLN 유전자의 돌연변이
65dc4e68da45daab46acda0c,얀스키-빌쇼스키병,신경세포세로이드라이포푸스신증\n(neuronal ceroid lipofuscinosis),"발작, 발달퇴행, 운동실조, 실명, 언어장애, 지적장애",TPP1 유전자의 돌연변이에 의해 발생하며 상염색체 열성 방식으로 유전
65dc4e6ada45daab46acda0e,바텐병,스필마이어-보그트병\n(Spielmeyer-Vogt’s disease)\n보그트-스필마이어 병\n(Vogt Spielmeyer Disease)\n보그트-스필마이어-쇼그렌 병\n(Vogt Spielmeyer Sjogren Disease)\n스필마이어-쇼그렌 병\n(Spielmeyer Sjogren Disease)\n얀스키 빌쇼스키병\n(Jansky Bielschowsky Disease)\n쿠프스 병\n(Kufs Disease),"망막색소변성과 시신경위축, 발작, 시력소실, 인격변화, 진행성 신경성 퇴행, 황반변성","상염색체열성유전 , CLN3 유전자의 돌연변이"
65dc4e6dda45daab46acda10,바텐병,스필마이어-보그트병\n(Spielmeyer-Vogt’s disease)\n보그트-스필마이어 병\n(Vogt Spielmeyer Disease)\n보그트-스필마이어-쇼그렌 병\n(Vogt Spielmeyer Sjogren Disease)\n스필마이어-쇼그렌 병\n(Spielmeyer Sjogren Disease)\n얀스키 빌쇼스키병\n(Jansky Bielschowsky Disease)\n쿠프스 병\n(Kufs Disease),"망막색소변성과 시신경위축, 발작, 시력소실, 인격변화, 진행성 신경성 퇴행, 황반변성","상염색체열성유전 , CLN3 유전자의 돌연변이"
65dc4e6fda45daab46acda12,쿠프스병,"신경세포세로이드 라이포푸스신증\n(Neuronal Ceroid Lipofuscinosis)\nNeuronal Ceroid Lipofuscinosis, 4b\nNeuronal Ceroid Lipofuscinosis, 6B\nNeuronal Ceroid Lipofuscinosis, 13","근간대성 발작, 소뇌 실조, 치매",Lysosomal storage disease
65dc4e71da45daab46acda14,니만-픽병,"니만-픽 병\n(Niemann-Pick Disease)\n스핑고지질증\n(Sphingolipidosis)\n지질 조직구증\n(lipid histiocytosis)\n스핑고마이엘린지질증\n(lipidosis, sphingomyelin)\n스핑고마이엘린 결핍증\n(sphingomyelinase deficiency)\n연소자형 이상긴장 지질증\n(juvenile dystonic lipidosis)\nDAF syndrome\nNieman Pick disease Type A(acute neuronopathic form)\nNieman Pick disease Type B\nNieman Pick disease Type C(chronic neuronopathic form)\nNieman Pick disease Type D(Nova Scotia variant)\nNieman Pick disease Type E","간비종대, 경련, 근긴장저하, 빈혈, 정간비종대, 경련, 근긴장저하, 빈혈, 정신지연, 황달","상염색체 열성유전\nNPD Type A,B : 11번 염색체 단완(11p15.1-p15.4)에 위치하는 acid sphingomyelinase (ASM) 유전자의 돌연변이\nNPD type C, D, E: 18번 염색체 장완(18q11-12)에 위치하는 콜레스테롤 대사에 관여하는 유전자(NPC1)의 돌연변이"
65dc4e74da45daab46acda16,크라베병,갈락토실세레마이드 지질증\n( )\n구상세포 백색질뇌증\n갈락토세레브로시드 베타-갈락토시다아제결핍증\n갈락토실세레마이드 결핍증\n공세포백색질장애\n부신백질디스트로피\n카나반 백질디스트로피\n이염성 백질디스트로피\n알렉산더 병,,상염색체 열성 유전
65dc4e76da45daab46acda18,고쉐병,"니만-픽병\n(Niemann-Pick disease)\n폼페병\n(Pompe’s disease)\nI형 점액다당류증\n(Mucopolysaccharidosis, type I)\n테이-삭스병\n(Tay-Sachs disease)","피로, 빈혈, 혈소판 감소(지혈이 잘 안됨), 간과 비장이 커짐, 골절이 쉽게 일어남, 사시, 발작","GBA (glucosylceramidase beta, HGNC ID: 4177, 22.6. 기준) 유전자 돌연변이로 인한 글루코세레브로시다제(Glucocerebrosidase)효소의 활성도 저하"
65dc4e79da45daab46acda1a,파브리(-앤더슨)병,고쉐병\n(Gaucher‘s disease)\n푸고스 축적증\n(Fucosidosis)\n광범위 몸통 혈관각화종\n(Angiokeratoma Diffuse)\n광범위 혈관각화종\n(Angiokeratoma Corporis Diffusum)\n세라마이드 트라이헥소사이드 부족(결핍)증\n(Ceramide Trihexosidase Deficiency)\n유전성 이영양성 지질증\n(Hereditary Dystopic Lipidosis ),"각막혼탁, 단백뇨, 혈뇨, 지방뇨, 만성 기관지염, 호흡 곤란, 부종, 설사, 행동 변화, 우울증, 울혈성 심부전","X 염색체 연관 열성으로 유전, X 염색체 장완 (Xq21.33-Xq22)에 위치하는 알파-갈락토시다제 A(alpha-galactosidase A: α-GAL, α-gal A) 유전자의 돌연변이"
65dc4e7bda45daab46acda1c,펠리제우스-메르츠바하병,"PLP1-연관 질환\n(PLP1-related disorders)\n알란-헌든-더들리 증후군\n(Allan-Herndon-Dudley syndrome)\n제2형 강직성 하반신 마비\n(Spastic paraplegia type 2: SPG2)\n펠리제우스-메르츠바하병-유사병\n(Pelizaeus-Merzbacher-like disease)\n저수초화 백질이영양증1\n(Hypomyelinating leukodystrophy1)\n미만성 가족성 뇌경화증\n(Sclerosis, diffuse familial brain)\n수단친화성 백질이영양증\n(Sudanophilic leukodystrophy)\n뇌경화증\n(Cerebral sclerosis)","강직 마비, 발달지연, 비정상적 안구운동, 시신경 위축, 운동실조","뇌수초 형성 장애 , myelin proteolipid protein(PLP)의 형성 장애"
65dc4e80da45daab46acda1e,이염성 백질디스트로피,"다발성 설파테이스 결핍\n(Multiple sulfatase deficiency)\n아릴황산분해효소 A 결핍\n(Arylsulfatase A deficiency, ARSA deficiency)\n황산세레브로사이드결핍\n(Cerebroside sulfatase deficiency)\n미만성뇌경화증\n(Diffuse brain sclerosis)\n미만성이염색형 대뇌경화증\n(Cerebral sclerosis diffuse metachromatic form)\n황화지질증\n(Sulfatide lipidosis)","경련, 근력저하, 무반응, 보행장애, 부정확한 발음, 시력과 청력 저하, 요실금, 치매","아릴황산분해효소 A (arylsulfatase A)를 만드는 ARSA나 PSAP 유전자의 돌연변이, 상염색체 열성유전"
65dc4e83da45daab46acda20,설파테이스결핍,다발성 설파테이스결핍\n(Multiple Sulfatase deficiency )\n다발성 설파테이스결핍 증후군\n( Multiple Sulfatase deficiency Syndrome )\n뮤코설파티도시스\n( Mucosulfatidosis),"발달 퇴행 등의 백색질형성장애 증상, 간비대 등 점액다당류증 증상, 피부의 비늘증(ichthyosis)",SUMF1 유전자의 돌연변이로 인한 효소 결핍
65dc4e85da45daab46acda22,카나반 병,"이염성 백질디스트로피\n(Metachromatic leukodystrophy)\n테이-삭스병\n(Tay-Sach’s disease)\nAspartoacylase 결핍증\n(aspartoacylase deficiency)\nACY2 결핍증\n(ACY2 deficiency )\nAminoacylase-2 결핍증\n(aminoacylase-2 deficiency)\nASP 결핍증\n(ASP deficiency )\n중추신경계통 해면변성증\n(spongy degeneration of central nervous system, spongy degeneration of neuroaxis )","강직, 근육긴장저하, 발달지연(목을 가누지 못함), 발작, 시각신경유두위축(이상), 정신 지연, 큰머리증","상염색체열성유전, ASPA 유전자 돌연변이"
65dc4e87da45daab46acda24,화버증후군,"세라마이드분해효소 결핍증\n(Ceramidase deficiency )\n산성 세라마이드분해효소 결핍증\n(Acid ceramidase deficiency)\nN-acylsphingosine amidohydrolase 결핍증\n(N-acylsphingosine amidohydrolase deficiency)\n척수근위축증-진행근간대뇌전증\n(Spinal muscular atrophy with progressive myoclonic epilepsy 1, SMA-PME 1)\n뇌전증없는 척수근위축증\n(Spinal muscular atrophy without epilepsy)\n골용해성 진행 성인발현형 단지증\n(Progressive adult-onset brachydactyly due to osteolysis )","관절통, 관절구축, 피부결절","지방 대사 과정 중 리소좀에 있는 acid ceramidase의 결핍으로 세라마이드가 여러 조직에 축적됨, 상염색체 열성질환, ASAH1 유전자 돌연변이"
65dc4e8ada45daab46acda26,강글리오시드증 NOS,"GM1-강글리오시드증\n(GM1-gangliosidosis )\nGM2-강글리오시드증\n( GM2-Gangliosidosis NOS )\n테이-삭스병\n( Tay-Sachs’ disease )\n샌드호프병\n( Sandhoff’s disease )\nAB 변이형 GM₂-강글리오시드증\n( GM₂-gangliosidosis, AB variant )\n성인형 GM2-강글리오시드증\n( Adult GM2-gangliosidosis )\n연소형 GM2-강글리오시드증\n( Juvenile GM2-gangliosidosis)","발달지연, 퇴행, 대두증, 인지기능 장애, 뇌전증, 실조증, 진행성 근육 위축, 간 비대, 비장 비대",유전자 돌연변이로 인한 효소 기능 저하
65dc4e8cda45daab46acda28,GM₃-강글리오시드증,Hematoside sphingolipodystrophy,"발달지연, 발작, 근긴장저하 등",상염색체 열성 유전
65dc4e8fda45daab46acda2a,GM₁-강글리오시드증,Morquio 증후군 B형,"특징적외모, 간비장비대, 근력저하 및 경직, 정신발달지체, 경련","GLB1 (galactosidase beta 1, HGNC ID: 4298, 22.6. 기준) 유전자의 돌연변이"
65dc4e91da45daab46acda2c,뮤코지질증 Ⅳ,"뮤코지질증 II\n(Mucolipidosis Ⅳ, I-cell disease)\n뮤코지질증 III\n(Mucolipidosis Ⅳ, Pseudo-Hurler polydystrophy)\n뮤코다당증\n(Mucopolysaccharidosis, MPS)\n사이알리피드증\n(Sialolipidosis)\n뇌성마비\nFree sialic storage disorders","각막 혼탁, 근긴장저하증, 정신지연, 성장지연, 정신운동 지연, 사시, 부은 눈꺼풀, 망막 퇴행, 약시, 근시, 철 결핍 빈혈증","염색체 19p13.3-p13.2에 위치하는 MCOLN1유전자의 돌연변이, 상염색체 열성으로 유전"
65dc4e94da45daab46acda2e,성인형 GM₂-강글리오시드증,GM2 강글리오사이드증\n(GM2 Gangliosidosis ),"간비장비대, 근긴장이상, 운동 실조증, 대두증, 발달장애, 불규칙한 안구운동, 정신질환, 척수전각 질환, 황반 변성소견","헥소사미니다제(Hexosaminidase A: Hex A) 효소의 결핍, 상염색체 열성유전"
65dc4e96da45daab46acda30,성인형 GM₂-강글리오시드증,GM2 강글리오사이드증\n(GM2 Gangliosidosis ),"간비장비대, 근긴장이상, 운동 실조증, 대두증, 발달장애, 불규칙한 안구운동, 정신질환, 척수전각 질환, 황반 변성소견","헥소사미니다제(Hexosaminidase A: Hex A) 효소의 결핍, 상염색체 열성유전"
65dc4e9cda45daab46acda32,샌드호프병,"GM2 강글리오사이드 제 2형\n(GM2-gangliosidosis, type l)\n강글리오사이드 베타 헥소사미니데이스 B 결핍증\n(Gangliosidosis Beta Hexosaminidase B Defeciency)\n강글리오사이드 GM2 제2 유형\n(Gangliosidosis GM2 Type 2)\n헥소사미니데이스 A, B 결핍증\n(Hexosaminidases A and B deficiency)",운동지연과 지적장애,헥소사미니데이스 B 효소(hexosaminidase B enzyme) 유전자의 돌연변이
65dc4e9eda45daab46acda34,GM₂-강글리오시드증,"GM2-강글리오시드증NOS\n(GM2-Gangliosidosis NOS )\n테이-삭스병\n( Tay-Sachs’ disease )\n샌드호프병\n( Sandhoff’s disease )\nAB 변이형 GM₂-강글리오시드증\n( GM₂-gangliosidosis, AB variant )\n성인형 GM2-강글리오시드증\n( Adult GM2-gangliosidosis )\n연소형 GM2-강글리오시드증\n( Juvenile GM2-gangliosidosis )\n강글리오시드증NOS\n( Gangliosidosis NOS )","발달 지연, 퇴행, 지적 장애, 뇌전증, 실조증, 근긴장이상증, 정신병, 근육 소모",유전자 돌연변이에 따른 베타-헥소사미니다아제 효소의 결핍
65dc4ea1da45daab46acda36,GM₂-강글리오시드증,"GM2-강글리오시드증NOS\n(GM2-Gangliosidosis NOS )\n테이-삭스병\n( Tay-Sachs’ disease )\n샌드호프병\n( Sandhoff’s disease )\nAB 변이형 GM₂-강글리오시드증\n( GM₂-gangliosidosis, AB variant )\n성인형 GM2-강글리오시드증\n( Adult GM2-gangliosidosis )\n연소형 GM2-강글리오시드증\n( Juvenile GM2-gangliosidosis )\n강글리오시드증NOS\n( Gangliosidosis NOS )","발달 지연, 퇴행, 지적 장애, 뇌전증, 실조증, 근긴장이상증, 정신병, 근육 소모",유전자 돌연변이에 따른 베타-헥소사미니다아제 효소의 결핍
65dc4ea3da45daab46acda38,GM₂-강글리오시드증,"GM2-강글리오시드증NOS\n(GM2-Gangliosidosis NOS )\n테이-삭스병\n( Tay-Sachs’ disease )\n샌드호프병\n( Sandhoff’s disease )\nAB 변이형 GM₂-강글리오시드증\n( GM₂-gangliosidosis, AB variant )\n성인형 GM2-강글리오시드증\n( Adult GM2-gangliosidosis )\n연소형 GM2-강글리오시드증\n( Juvenile GM2-gangliosidosis )\n강글리오시드증NOS\n( Gangliosidosis NOS )","발달 지연, 퇴행, 지적 장애, 뇌전증, 실조증, 근긴장이상증, 정신병, 근육 소모",유전자 돌연변이에 따른 베타-헥소사미니다아제 효소의 결핍
65dc4ea6da45daab46acda3a,옥살산뇨,"제 1형 원발성 고옥살산뇨증\n(Primary hyperoxaluria type I, PH I )\n제 2형 원발성 고옥살산뇨증\n( Primary hyperoxaluria type II, PH II )\n제 3형 원발성 고옥살산뇨증\n( Primary hyperoxaluria type III, PH III)","요로결석 및 신장결석으로 인한 배뇨통, 혈뇨 및 이차적 요로감염",유전자 변이로 인한 효소의 결핍. 상염색체 열성 유전
65dc4ea8da45daab46acda3c,피루브산염대사 및 포도당신합성 장애,카복실레이스피루브산염의 결핍\n(Deficiency of carboxylase pyruvate )\n포스포에놀피루브산염 카르복시카이네이스의 결핍\n( Deficiency of phosphoenol-pyruvate carboxykinase )\n탈수소효소피루브산염의 결핍\n( Deficiency of dehydrogenase pyruvate )\n피루브산카이네이스 결핍성 빈혈\n( Pyruvate kinase[PK] deficiency anaemia),"젖산과다증, 저혈당증, 신경증상(경련, 혼수, 근긴장 이상) , 발육장애, 신세뇨관 산증, 간비대",상염색체 열성 대사이상질환. 염색체 11번(11q13.2)의 PC 유전자 이상
65dc4eabda45daab46acda3e,탈수소효소피루브산염의 결핍,탈수소효소 초성포도당염 결핍증을 동반한간헐성 조화운동불능증\n(itermittent ataxia with pyruvate dehydrogenase deficiency)\n탄수화물 민감성을 동반한 젖산혈증과 피루브산염(초성포도당염) 산혈증\n(lactic and pyruvate acidemia with carbohydrate sensitivity)\n간헐성 조화운동불능증과 허약감을 동반한젖산혈증과 피루브산염(초성포도당염) 산혈증\n(lactic and pyruvate acidemia with episodic ataxia and weakness)\n레이증후군\n(Leigh syndrome),"젖이나 우유를 잘 빨지 못함, 기면, 조화운동불능(Ataxia), 운동능력의 발달지연","유전자(PHE1A, PDX1)의 돌연변이, 상염색체 열성 형질로 유전"
65dc4eadda45daab46acda40,카복실레이스피루브산염의 결핍,레이 증후군\n(Leigh syndrome)\n초성포도당염 탈수소효소 결핍증\n(Pyruvate dehydrogenase complex deficiency (PDCD))\n비오티니다제 결핍증\n(Biotinidase deficiency)),"경련, 혼수, 근긴장이상, 젖산혈증","PC 유전자 돌연변이 (11q13.2), 상염색체 열성질환"
65dc4eb0da45daab46acda42,포스포에놀피루브산염카르복시카이네이스의 결핍,"중쇄 아실코에이 탈수소효소 결핍증\n(medium chain acyl-coA dehydrogenase deficiency(MCAD))\n장쇄 3-수산화아실코에이 탈수소효소결핍증\n(long-chain 3-hydroxyacyl-CoA dehydrogenase deficiency(LCHAD))\n당원축적병\n(glycogen storage disorders)\n과당-1, 6-이인산분해효소결핍증\n(Fructose-1,6-bisphosphatase deficiency)\n피루브산 탈탄산효소 결핍증\n(Pyruvate carboxylase deficiency)\n피루브산 탈수소 효소 결핍증\n(Pyruvate dehydrogenase deficiency )","간의 크기가 커짐, 근육의 긴장성이 저하, 몸무게의 증가와 성장이 둔화, 저혈당증, 젖산혈증",상염색체 열성 형질로 유전
65dc4eb2da45daab46acda44,갈락토카이네이스결핍,제2형 갈락토오즈혈증\n(Galactosemia type 2 or GALK deficiency)\n갈락토스‑1‑인산 우리디릴 전달효소 결핍\n(Galactose-1 phosphate uridyl transferase deficiency)\n갈락토스-6-인산 에피머라제 결핍\n(Galactose-6-phosphate epimerase deficiency),백내장,"GALK1 gene mutation (chromosome 17q24), 상염색체 열성유전"
65dc4eb7da45daab46acda46,갈락토스혈증,고전적 갈락토스혈증\n갈락토스-1-인산염 유리딜 전이효소 결핍증\nGALT 결핍\n갈락토키나아제 결핍\n포도당 육 인산화 효소 결핍,"간비대, 고암모니아혈증, 기면, 백내장, 복수(ascites)가 차며, 부종(edema)이 생김, 설사, 성장지연, 신생아 시 수유부진, 황달, 간비대, 아미노산과 단백질이 소변으로 배출, 복수(ascites)가 차며, 부종(edema)이 생김, 설사, 기면, 성장지연, 고암모니아혈증, 패혈증, 백내장","상염색체 열성 형질로 유전, 9번 염색체의 짧은 팔에 위치(9p13)하고 있는 GALT 유전자에 이상"
65dc4eb9da45daab46acda48,갈락토스대사장애,갈락토스-1-인산염 유리딜 전이효소 결핍증\n(Galactose-1-phosphate uridyl transferase deficiency)\nGALT 결핍\n(GALT deficiency)\n갈락토키나아제 결핍\n(Galactokinase deficiency)\n포도당 육 인산화 효소 결핍\n(glucose 6-phosphate deficiency),"간비대, 고암모니아혈증, 기면, 백내장, 복수(ascites)가 차며, 부종(edema)이 생김, 설사, 성장지연, 신생아 시 수유부진, 황달, 간비대, 아미노산과 단백질이 소변으로 배출, 복수(ascites)가 차며, 부종(edema)이 생김, 설사, 기면, 성장지연, 고암모니아혈증, 패혈증, 백내장","상염색체 열성 형질로 유전, 9번 염색체의 짧은 팔에 위치(9p13)하고 있는 GALT 유전자에 이상"
65dc4ebcda45daab46acda4a,간인산화효소결핍,당원 축적병 제 6형\n(Glycogen storage disease 6 )\n글리코겐증 VI형\n( Glycogenosis Type VI )\n허스병\n( Hers disease )\n인산화 효소 결핍 글리코겐증\n( Hepatophosphorylase Deficiency Glycogenosis )\n인산화 효소 결핍 당원 축적병\n( Phosphorylase deficiency glycogen-storage disease of liver),"간비대증, 저혈당증, 성장지연, 근력약화",간인산화효소(Liver phosphorylase) 결핍
65dc4ebeda45daab46acda4c,글리코젠축적병,GSD 0a\nHypoglycemia with deficiency of glycogen synthetase in the liver\nLiver glycogen synthase deficiency\nLiver glycogen storage disease 0,"저혈당증, 간의 지방증",Glycogen synthase-2 효소결핍
65dc4ec1da45daab46acda4e,글리코젠축적병 1b형 A,글리코젠증 Ib형\n(Glycogenosis Type Ib)\n글루코오스-6-인산 트란스로케이스 결핍증\n(glucose-6-phosphate translocase deficiency),"호중구 감소증, 염증성 장질환, 저혈당, 젖산산증, 고요산혈증, 고지혈증",상염체성 열성
65dc4ec3da45daab46acda50,글리코젠합성효소결핍,간 글리코젠합성효소결핍\n(Liver glycogen synthase deficiency)\n간 글리코젠축적병 0a형\n(Liver glycogen storage disease type 0a),"저혈당증, 간의 지방증",Glycogen synthase 효소결핍
65dc4ec6da45daab46acda52,허스병,인산화 효소 결핍 글리코겐증\n(Hepatophosphorylase Deficiency Glycogenosis)\n간 인산화 효소 결핍증\n(Liver Phosphorylase Deficiency)\n인산화 효소 결핍 당원 축적병\n(Phosphorylase Deficiency Glycogen Storage Disease ),"간비대증, 성장지연, 저혈당증, 케톤산증",간인산화효소(Liver phosphorylase) 결핍
65dc4ec8da45daab46acda54,폼페병,심비대 글리코겐 확산증\n(Cardiomegalia Glycogenica Diffusa)\n전신성 글리코겐증\n(Generalized Glycogenosis)\n리소솜 글루코시다아제 결핍\n(Lysosomal Glucosidase Deficiency),"비대심장근육병증, 혀가 튀어나옴, 호흡기 이상, 심각한 호흡(기능)부전, 두통, 수면장애, 오심, 기좌호흡, 간비대","산 알파-글루코시다아제(Acid alpha-glucosidase)의 결핍, 상염색체 열성 형질로 유전"
65dc4ecbda45daab46acda56,폰기에르케병,간신글리코겐생성\n(Hepatorenal Glycogenosis)\n당원 축적병 IA형\n(Glycogen Storage Disease type IA)\n당원 축적병 IB형\n(Glycogen Storage Disease type IB ),"간비대(hepatomegaly), 성장지연, 자극과민성, 체중 감소, 피로","포도당-6-포스파타아제(Glucose-6-phosphatase)의 결핍, 상염색체 열성 형질로 유전"
65dc4eceda45daab46acda58,코리병,"아밀로-1,6-글루코시다아제 부족(결핍)증\n(Amylo-1,6-Glucosidase Deficiency)\n코리병\n(Cori Disease)\n가지제거 부족(결핍)증\n(Debrancher Deficiency)\n당원 축적병 III\n(Glycogen Storage Disease III)\n글리코겐증 III형\n(Glycogenosis Type III)\n한계 덱스트린증\n(Limit Dextrinosis)","간비대, 근육의 이완","아밀로-1,6-글루코시다아제(Amylo-1,6-glucosidase)가 부족, 상염색체 열성 형질로 유전"
