_id,disease_korean_title,related_diseases,diseases_symptoms,cause_diseases
65dc48abda45daab46acd5c8,촤지 증후군,"CHARGE association (coloboma, heart anomaly, choanal atresia, retardation, genital and ear anomalies)\nHall-Hittner syndrome (HHS)\nChoanal atresia, posterior","안조직결손, 후비공폐쇄, 뇌신경 이상, 특징적 CHARGE 증후군 귀, 심장결함, 생식기 이상, 발달지연, 발육 불량, 몸통 근육긴장저하, 입술갈림증, 입천장갈림증, 기관식도샛길, 식도폐쇄증","CHD7 유전자 돌연변이 (산발성), 상염색체우성유전(60%-65%)"
65dc48aeda45daab46acd5ca,젤웨거 증후군,과산화소체형성장애\n(Zellweger cerebrohepatorenal syndrome)\n퍼옥시좀형성장애\n(Peroxisome biogenesis disorder),"두개골의 기형, 근육 톤의 저하, 안구진탕, 간비 비대, 정신운동기능의 지연",과산화소체(peroxisome) 형성 장애를 일으키는 유전자의 돌연변이
65dc48b0da45daab46acd5cc,펠란-맥더미드 증후군(22장완 13.3 결손 증후군),22번 염색체 장완 13.3 부분의 결손 증후군\n(22q13 deletion syndrome)\n미세 결실 증후군\n(microdeletion syndrome),"저긴장증, 전반적인 발달지연, 현저한 언어발달 지연, 선천성 기형 등",22번 염색체 장완 원위부 13.3 부분의 결손
65dc48b3da45daab46acd5ce,ADNP 증후군(헬스무르텔-반데르아 증후군),"ADNP(activity-dependent neuroprotector homeobox gene)-related intellectual disability and autism spectrum disorder\nADNP-related multiple congenital anomalies-intellectual disability-autism spectrum disorder\nHelsmoortel-van der Aa syndrome\nHVDAS\nmental retardation, autosomal dominant 28\nMRD28","발달 지연, 지적 장애, 유아기의 섭식 곤란, 심장 기형, 근육 긴장 저하",ADNP유전자의 돌연변이
65dc48b8da45daab46acd5d0,아가미-귀-신장 증후군,아가미-귀-신장 증후군\n(Branchio-oto-renal syndrome)\n아가미-귀 증후군\n(Branchio-oto syndrome)\n멜닉-프레이저 증후군\n(Melnick-Fraser syndrome),"아가미궁(branchial arch) 형성이상, 바깥귀 기형, 청력 손실, 신장 기형","EYA1, SIX1, SIX5 유전자 변이에 의한 선천적 결함"
65dc48bada45daab46acd5d2,코핀-로우리 증후군,뼈연골 이상을 동반한 정신지체\n(Mental retardation with osteocartilaginous abnormalities )\n성염색체 관련 정신지체\n( X-linked mental retardation ),"감각신경난청, 성장지연, 이상한 얼굴모습, 정신지연","성염색체 열성 유전, X 염색체에 있는 RSK2 단백질의 생산을 조절하는 RPS6KA3 (RSK2) 유전자 돌연변이"
65dc48bdda45daab46acd5d4,마르팡증후군,"마르팡 증훈군 또는 마르판 증후군\n(Marfan’s syndrome)\n거미손가락증\n(Arachnodactyly)\n구축성 거미손가락증\n(Contractural Arachnodactyly)\n세장사지증, 거미다리증, 거미팔증\n(Dolichostenomelia)\n마르판(팡) 과운동 증후군\n(Marfanoid Hypermobility Syndrome)","키가 크고, 마르고, 얼굴과 사지가 길다, 척추측만증, 승모판 탈출증, 기흉, 수정체 위치이상, 녹내장, 백내장, 근시, 안구돌출, 경막확장, 평발, 거미다리증(dolichostenomelia), 거미손가락증(Arachnodactyly), 오목가슴, 새가슴, 관절 과운동, 손가락굽증(Camptodactyly), 긴머리증(Dolichocephaly), 작은턱증, 광대뼈 형성저하증(Malar hypoplasia), 대동맥판역류(Aortic regurgitation), 망막 박리, 서혜부 탈장","상염색체 우성형질로 유전, 염색체 15번에 위치한 FBN1 유전자의 돌연변이, 염색체 3번의 단완(p)(3p22)에 위치하는 TGF-베타 수용체 2(TGFBR2)유전자의 돌연변이"
65dc48bfda45daab46acd5d6,베크위트-비데만 증후군,베크위트증후군\n(Beckwith Syndrome)\n비데만-베크위트증후군\n(Wiedemann-Beckwith syndrome)\nExomphalos - macroglossia - gigantism,"거대발육, 큰혀증, 귀이상 (주름 혹은 작은 구멍), 배꼽탈장, 복강 내 장기 비대(간, 비장, 신장, 부신, 췌장), 배아종 (윌름스종양, 간모세포종, 신경모세포종, 횡문근육종), 반측비대 (hemihyperplasia), 부신피질비대세포, 신장 이상(수질형성이상, 콩팥석회증, 수질성 해면신, 신비대), 입천장갈림증, 화염상 모반, 잠복고환","염색체 이상(모계 염색체 11p15 전좌나 역위 혹은 부계 염색체 11p15 중복), 11p15.5의 부계 편부모이체성, KCNQ1OT1 (각인센터2)의 메틸화 소실, H19(각인센터1)의 메틸화 획득, 각인센터1 혹은 각인센터2의 미세결실 등 다양한 이상발견"
65dc48c2da45daab46acd5d8,소토스 증후군,대뇌성 거인증\n(Cerebral giantism),"특징적인 얼굴모양, 학습장애, 소아기의 과도한 성장",NSD1 유전자의 돌연변이나 NSD1 유전자를 포함한 염색체 5q35미세결손
65dc48c4da45daab46acd5da,위버 증후군,Camptodactyly-overgrowth-unusual facies\nWeaver-Smith syndrome,"두개안면부이상, 사지골격이상, 지능저하, 행동 및 성장발달장애, 신경학적 장애, 심장기형, 비뇨기계 기형.","산발적인 발생을 보이는 경우도 있으나, EZH2 유전자 돌연변이와 관련된 경우 상염색체 우성유전 방식으로 유전됨."
65dc48c7da45daab46acd5dc,바테르 증후군,"VACTER 연합\n(VACTER association)\n선천성 식도 폐쇄 및 식도 기관루\n(esophageal atresia and tracheoesophageal fistula)\n척추, 직장 항문, 심장, 신장 및 팔과 사지 기형\n(vertebral, anorectal, cardiac, renal and radial and limb anomalie)","양수과다증, 코와 입으로부터 다량의 분비물, 수유시 기침, 호흡곤란증, 비위관의 진입불가, 청색증, 복부 팽만, 태변배출 이상, 다지증",원인불명
65dc48c9da45daab46acd5de,손발톱무릎뼈 증후군,퐁 병\n(Fong Disease)\n유전성 손톱 뼈 이형성증\n(Hereditary Onychoosteodysplasia (HOOD))\n손톱 뼈 이형성증\n(Onychoosteodysplasia)\n터너-카이저 증후군손톱\n(Turner-Kieser Syndrome)\n무릎뼈 증후군의 약어\n(NPS),"손톱 결함, 무릎 뼈 이상, 팔굼치 이상, 엉덩이뼈 돌기, 손등주름 감소, 근위지간 관절 젖힘, 새끼손가락 측만지증, 박리뼈연골염, 활액 주름(Synovial plicae), 전방십자인대의 결여, 초기 퇴행성 관절염, 외반첨족(Equinovalgus), 내반첨족(Equinovarus), 외반구족(Dalcaneovalgus), 내반 구족(Dalcaneovarus), 과뒤굽힘(Hyperdorsiflexion), 평발, 허리앞굽음증, 척추측만증, 척추앞전위증(Spondylolisthesis), 척추분리증(Spondylolysis), 오목 가슴, 마른 체형, 신부전증, 단백뇨, 미세 구조적 이상, 개방각녹내장(Open-angle glaucoma), 고안압증(ocular hypertension), 녹내장, 홍채색소 변성, 변비, 과민성대장증후군, 고통과 온도에 둔감, 간헐적 무감각, 저림, 화끈감, 간질, 혈액순환 장애, 치아의 약함, 부서진 치아, 얇은 치아 사기질.",염색체 9q34에 위치하는 LMX1B 유전자의 돌연변이
65dc48ccda45daab46acd5e0,루빈스타인-테이비 증후군,"Rubinstein 증후군, Broad thumb-hallux 증후군, Michail-Matsoukas-Theodorou-Rubinstein-Taybi 증후군\n(Broad thumbs and great toes, characteristic facies, and mental retardation)\n넓은 엄지손가락-발가락 증후군\n(Broad thumb-hallux syndrome)","소두증, 진한 눈썹, 처진 눈, 매부리코, 처진 귀, 이상한 모양의 귀, 작은 상악 및 턱, 눈꺼풀처짐, 넓은 엄지손가락, 넓고 큰 첫 번째 발가락, 합지증, 다지증, 척주측만증, 척주후만증, 흉골 및 늑골 이상, 골성숙 지연, 저신장, 발달지연, 정신지연, 근육긴장저하, 언어지연, 행동장애 및 정신 질환, 선천심장병, 신장 기형 동반","상염색체우성유전 , 16p13.3 미세결실 , CREBBP (16p13.3) 유전자 돌연변이 혹은 미세결실 , EP300 (22q13.2) 유전자 돌연변이"
65dc48ceda45daab46acd5e2,클리펠-트레노우네이-베버 증후군,Parkes Weber 증후군\n(Parkes Weber syndrome)\nKlippei-Trenaunay 증후군\n(Klippei-Trenaunay syndrome)\nKasabach-Merritt 증후군\n(Kasabach-Merritt syndrome)\n혈관 골 비후 증후군\n(angioosteohypertrophy syndrome)\n피하 모세혈관 기형\n(cutaneous capillary malformation)\n선천성 혈관성 반점\n(congenital vascular nevus)\n모세혈관종\n(capillary hemangioma)\n포트 와인 혈관종\n(port-wine stain),"피하 혈관종, 정맥류성 정맥, 사지의 편측 비대","명확한 원인은 밝혀져 있지 않음 , 염색체 이상과 관련 유전자의 변이"
65dc48d3da45daab46acd5e4,홀트-오람 증후군,심장-손 증후군\n(heart-hand syndrome ),"상지의 기형, 선천성 심장 기형, 심장 전도 장애",TBX5 유전자의 돌연변이
65dc48d5da45daab46acd5e6,드 랑즈 증후군,"드 랑에 증후군\n(De Lange Syndrome)\n브라치멘-드 랑에 증후군\n(BDLS, Brachmann-de Lange Syndrome)\n브라치멘-드 랑에 증후군\n(Brachmann-de Lange Syndrome)\n코넬리아 드 랑에 증후군\n(CdLS, Cornelia de Lange Syndrome)\n드 랑즈 증후군, 드 랑게 증후군)\n(de Lange Syndrome)\n암스테르담 증후군\n(Amsterdam syndrome)","성장지연, 소두증, 일자눈썹, 긴 인중, 구개열, 높은 입천장, 작은 턱(소하악증), 턱뼈 돌기, 짧고 두꺼운 목, 골격계 기형, 요골형성부전, 불규칙한 월경, 자해, 수면장애, 손발가락부족증, 대리석피부증, 다모증, 수유곤란, 과다활동, 행동장애, 지적장애, 합지증, 측만지증, 짧은 흉골과 갈비뼈의 이상, 잠복고환, 자궁의 이상 발달, 심장기형(심실중격결손), 발작, 빈번한 호흡기계 감염, 혈소판 감소증","5번 염색체 위에 존재하는 NIPBL 유전자와, X 염색체 상에 존재하는 SMC1L1 유전자의 돌연변이. 상염색체 우성, X-연관 유전"
65dc48d8da45daab46acd5e8,러셀-실버 증후군,"러셀 실버 증후군\n(RSS, Russell Silver Syndrome)\n러셀 증후군\n(Russell Syndrome)\n러셀 실버 왜소증\n(Russell-Silver Dwarfism)\n실버 러셀 증후군\n(SRS, Silver-Russell Syndrome)\n실버 증후군\n(Silver Syndrome)\n실버-러셀 왜소증\n(Silver-Russell Dwarfism)\n실버-러셀 증후군\n(Silver-Russell Syndrome)","성장지연, 작은 턱, 삼각형 얼굴모양, 청색공막(푸른 공막: Blue sclera),\n편측비대, 높고 좁은 입천장, 측만지증, 밀크 커피색 반점(cafe-au-lait spot), 생식기 기형, 조기사춘기","돌연변이, 상염색체 우성 형질로 유전되지만, 드물게 상염색체 열성 또는 X-연관 우성 형질로 유전되기도 함"
65dc48dada45daab46acd5ea,로비노-실버만-스미스 증후군,로비노 증후군\n(Robinow Syndrome)\n태아 얼굴 증후군\n(Fetal Face Syndrome)\n로비노 왜소증\n(Robinow Dwarfism)\n얼굴과 생식기 이상을 가진 말단뼈발생이상\n(Acral Dysostosis with Facial and Genital Abnormalities)\n중사지증을 가진 갈비척추 분할 결함\n(Costovertebral segmentation defect with mesomelia (formerly),"작은 키(왜소증), 대두증, 두눈먼거리증, 낮은 콧대, 긴 인중, 혀유착증, 귀의 기형, 잇몸 증식증, 골격계 기형(오목가슴, 척추측만증, 측만지증, 손발톱의 형성부전, 반척추뼈증), 생식기 기형, 심장 기형, 생식기 모양이 모호해서 남녀 구분하기가 어려움, 작은음경증, 잠복고환증, 음핵(clitoris)의 발육부전, 수신증, 탈장","상염색체 우성 또는 열성 형태로 유전, 유전 형태가 명확하게 분류되지 않는 경우도 있음(약 20%), 열성 형태에서, 9q22에 위치하는 ROR2 유전자의 돌연변이"
65dc48ddda45daab46acd5ec,프라더-윌리 증후군,잠복고환증-왜소증-지능저하증\n(Cryptorchidism-Dwarfism-Subnormal Mentality)\n당뇨소인이 있는 생식샘 기능 저하 영양장애\n(Hypogenital Dystrophy with Diabetic Tendency)\n근육긴장 저하(저장성:低張性)-정신발육장애-성선부전증-비만 증후군\n(Hypotonia-Hypomentia-Hypogonadism-Obesity Syndrome)\n프라더-래브하트-윌리 판콘 증후군\n(Prader-Labhart-Willi Fancone Syndrome)\n윌리-프라더 증후군\n(Willi-Prader Syndrome),"저신장(작은 키), 비만, 성선기능 저하증, 지적장애, 근육긴장 저하, 사시, 고체온증, 작은턱, 행동장애, 인식능력의 장애, 과도한 식욕, 말단왜소증, 잠복고환증, 수면장애","15q11.2-q13에 위치하는 프라더-윌리 증후군/엔젤만 증후군 영역(PWS/AS)의 결손, 모성 편친 이체증:maternal uniparental disomy), 유전자 각인"
65dc48dfda45daab46acd5ee,굴지 형성이상,"굴지 왜소증\n(Campomelic dwarfism)\nSOX9 유전자 돌연변이증후군\n(SRY-Box 9(SOX9) mutations syndrome)\n긴 사지 형의 굴지 증후군\n(Camptomelic syndrome, long-Limb type)\nLong-limb type camptomelic dwarfism\nCMDI\nDwarfism, campomelic\nCamptomelic syndrome\nAcampomelic campomelic dysplasia","곤봉발(clubfoot), 구개열, 기관(trachea)의 발육부전, 남성생식기의 불완전 발달, 다리의 긴뼈가 굽어져 있음, 얼굴의 비정상적 모양, 구개열, 기관 및 흉곽의 발 육 부전, 곤봉발(clubfoot), 남성생식기의 불완전 발달",상염색체우성유전
65dc48e2da45daab46acd5f0,주로 단신과 관련된 선천기형증후군,아르스코스 증후군\n(Aarskog syndrome)\n코케인 증후군\n( Cockayne syndrome)\n드 랑즈 증후군\n( De Lange syndrome)\n두보위츠 증후군\n( Dubowitz syndrome)\n누난 증후군\n( Noonan syndrome)\n프라더 윌리 증후군\n( Prader-Willi syndrome)\n로비노-실버만-스미스 증후군\n( Robinow-Silverman-Smith syndrome)\n러셀-실버 증후군\n( Russell-Silver syndrome)\n시클 증후군\n( Seckel syndrome)\n스미스-렘리-오피츠 증후군\n( Smith-Lemli-Opitz syndrome)\n쉐그렌-라손 증후군\n( Sjogren-Larsson syndrome)\n홀트-오람 증후군\n( Holt-Oram syndrome),"얼굴, 골격, 생식기계의 이상, 넓은 이마와 둥근 얼굴, 두눈먼거리증, 안검하수증, 눈꺼풀 틈새, 넓은 콧등, 사시, 원시, 눈근육마비, 위턱뼈형성저하증, 치아 이상, 긴 인중, 작은 키, 두갈래음낭 (이열음낭), 오목 가슴, 서혜부탈장, 귀의 기형, 합지증, 단지증, 측만증, 발가락굽증, 숨은척추갈림증, 잠복 고환증, 요도밑열림증, 정신 지체, 과다행동증",유전 질환
65dc48e5da45daab46acd5f2,코케인 증후군,"코케인 증후군\n(CS, Cockayne Syndrome)\n난청-왜소증-망막 위축증\n(Deafness-Dwarfism-Retinal Atrophy)\n망막 위축증과 난청을 동반하는 왜소증\n(Dwarfism with Renal Atrphy and Deafness)\n닐-딩월 증후군\n(Neil-Dingwall Syndrome)\n조로성 왜소증\n(Progeroid Nanism)","성장 지연, 왜소증, 광과민성(Photosensitivity), 나이에 비해 조숙해 보이는 외모(조로증), 소두증, 백내장, 시신경위축, 망막변성, 귀의 기형, 난청, 새부리 모양의 코, 턱나옴증, 치아이상, 피부 색소 침착, 척추후만증, 저한증, 청색증, 진전, 운동실조, 조화 운동 불능증, 고혈압, 동맥경화성 질환, 간비대, 지적장애","5번 염색체의 ERCC8 유전자의 변이(제A형), 10번 염색체의 ERCC6 유전자의 변이(제B형), 상염색체 열성으로 유전"
65dc48e7da45daab46acd5f4,쉐그렌-라손 증후군,Ichthyosis\nSpastic Neurologic Disorder\nMental Retardation\nSLS,"지적장애, 언어발달 지연, 비늘증, 경련, 마비",상염색체 열성 유전
65dc48eada45daab46acd5f6,스미스-렘리-오피츠 증후군,스미스-렘리-오피쯔 증후군\n(Smith Lemli Opitz Syndrome)\nDHCR7 유전자 이상\n(DHCR7 abnormality)\n처음으로 발견된 세 명의 환자들 이름의 첫 글자를 따서 만든 약어 RSH 증후군\n(RSH Syndrome),"성장 지연, 작은 머리(소두증), 정신 지체, 심장기형, 다지증, 구개열(입천장 갈림증: Cleft palate), 안검하수증, 백내장, 사시, 들창코, 작은 턱, 경련, 유문협착증, 청력 상실","DHCR7 유전자의 변이, 상염색체 열성으로 유전"
65dc48eeda45daab46acd5f8,시클 증후군,"새머리 모양의 왜소증, 시클 타입\n(Bird-Headed Dwarfism, Seckel Type)\n작은 머리 원발성 왜소증 1\n(Microcephalic Primordial Dwarfism 1)\n소두증 왜소증\n(Nanocephalic Dwarfism)\n시클 타입 왜소증\n(Seckel Type Dwarfism)","소두증, 왜소증, 지적장애, 얼굴의 기형(코가 새부리 모양으로 돌출됨, 눈이 크고 얼굴 폭이 좁음, 납작한 이마, 작은 머리둘레), 귀의 기형, 요골탈구 및 엉덩이 기형, 측만지증, 팔꿈치 탈구, 두개골조기유합증, 휜발, 잠복고환증, 음핵비대증, 다모증, 범혈구감소증","상염색체 열성 형질로 유전, 시클 증후군 1은 3번 염색체(3q22.1-q24)에 위치한 ATR 유전자, 시클 증후군 2는 18번 염색체(18p11.31-q11), 시클 증후군 3은 14번 염색체(14q21-q22)의 돌연변이"
65dc48f1da45daab46acd5fa,아르스코그 증후군,아르스코그-스콧 증후군\n(Aarskog-Scott Syndrome)\nFGDY: X염색체에 있는 유전자 이름\n(FGDY)\n얼굴 손가락 생식기관 증후군\n(Faciodigitogenital Syndrome)\n얼굴 생식기관 형성이상\n(Faciogenital Dysplasia)\n스콧 아르스코그 증후군\n(Scott Aarskog syndrome),"얼굴, 골격, 생식기계의 이상, 넓은 이마와 둥근 얼굴, 두눈먼거리증, 안검하수증, 눈까풀 틈새, 넓은 콧등, 사시, 원시, 눈근육마비, 위턱뼈형성저하증, 치아 이상, 인중이 길다. 작은 키, 두갈래음낭(이열음낭), 오목가슴, 서혜부탈장, 귀의 기형, 합지증, 단지증, 측만지증, 발가락굽증, 숨은척추갈림증, 잠복고환증, 요도밑열림증, 정신 지체, 과다행동증, 성장장애, 만성 호흡계 감염, 구개열, 구순열,","X-연관 열성 형질로 유전, Xp11.21에 위치하는 FGD1 유전자의 돌연변이, 유전자가 규명되지 않은 아르스코그 증후군도 있음"
65dc48f3da45daab46acd5fc,누난 증후군,"여성 가성 터너 증후군\n(Female Pseudo-Turner Syndrome)\n남성 터너 증후군\n(Male Turner Syndrome)\nNoonan Syndrome의 약어, 누난 증후군\n(NS)\n정상 염색체핵형을 가진 터너 표현형, 터너유사증후군\n(Turner Phenotype with Normal Chromosomes(Karyotype))","작은키, 뾰족머리증, 작은 턱(소하악증), 익상경, 양안격리증(두눈먼거리증), 안검하수증, 사시, 내안각주름(눈구석주름), 낮은 코, 높은 입천장, 부정교합, 귀의 기형, 골격계 기형(오목가슴, 척추후만증, 척추측만증), 외반팔꿉, 심장 기형(폐판막협착증, 심방중격 결손, 심실 중격 결손, 중격 비대, 비후성 근육병증, 동맥관 개존증 ), 색소성 모반, 악성고열, 혈관 및 림프관 기형, 혈액응고 결함, 폐동맥 협착증, 청색증(Cyanosis), 호흡곤란, 복부 팽창, 섭취장애, 지적장애, 잠복고환증,","6개 이상의 여러 유전자(PTPN11, KRAS, SOS1과 RAF1 포함)에서 돌연변이가 일어나는 상염색체 우성 유전 질환"
65dc48f6da45daab46acd5fe,두보위츠 증후군,두보위쯔 증후군\n(Dubowitz Syndrome)\n두보비츠 증후군\n(Dubowitz Syndrome)\n자궁내 왜소증\n(Intrauterine Dwarfism)\n왜소증-습진-특이 얼굴 증후군\n(Dwarfism-eczema-peculiar facies Syndrome),"성장장애, 왜소증, 삼각형 모양의 얼굴 형태, 안검하수증, 작은 머리(소뇌증: Microencephaly), 실눈증, 양안격리증(두눈먼거리증), 눈구석 격리증, 귀의 기형, 소하악증(작은 턱), 구개열, 치아부족증, 손발가락붙음증, 경미한 정신 지체, 습진(Eczema), 코폴립(Nasal polyp)",정확한 원인은 밝혀지지 않음
65dc48f9da45daab46acd600,로빈 증후군,"피에르 로빈\n(Pierre Robin)\n피에르(삐에르) 로빈 이상\n(Pierre Robin Anomalad)\n피에르(삐에르) 로빈 콤플렉스\n(Pierre Robin Complex)\n피에르(삐에르) 로빈 변형\n(Pierre Robin Deformity)\n피에르 로빈 기형 연쇄\n(Pierre Robin Malformation Sequence)\n피에르 로빈 증후군\n(Pierre Robin Syndrome)\n피에르 로빈 세징후\n(Pierre Robin Triad)\n로빈 이상\n(Robin Anomalad)\n로빈 콤플렉스\n(Robin Complex)\n로빈 증후군\n(Robin syndrome)\n설하수, 작은턱, 구개열\n( Glossoptosis, Micrognathia, and Cleft Palate)","작은턱증(소하악증, Micrognathia), 설하수증(Glossoptosis), 구개열(입천장 갈림증), 중이염, 각막경화증, 근시, 원시, 난시, 심혈관계 이상(폐고혈압, 폐동맥판협착증, 동맥관개존증), 고관절 기형, 대퇴부 기형, 합지증, 손발가락부족증, 척추전만증, 척추후만증), 간질발작 (epilepsy), 수두증, 근육긴장저하, 잠복고환증(남성)",정확한 원인은 알려지지 않음
65dc48fbda45daab46acd602,골덴하 증후군,"얼굴-귓바퀴-척추 증후군\n(FAV (Facio-Auriculo-Vertebral))\n첫째, 둘째 인두굽이(아가미굽이) 증후군\n(First and Second Branchial Arch Syndrome)\n골덴하-골린 증후군\n(Goldenhar-Gorlin Syndrome)\n눈 귀바퀴 척추 형성장애\n(Oculo-Auriculo-Vertebral Syndrome/Dysplasia)\n눈-귓바퀴-척추 증후군/형성장애","머리와 얼굴 기형(실눈증, 무안구증, 사시, 턱뼈의 발달이상, 측두 형성저하증, 구개열, 구순열, 부정교합, 귀의 기형, 난청), 입천장인두기능부전, 식도폐색증, 골격계 기형(척추, 손, 발), 호흡기 감염, 수면무호흡증, 뇌탈출증(Encephalocele), 수두증, 마비, 척추갈림증, 지적장애, 심실중격결손, 동맥관개존증, 폐동맥협착, 대동맥기승, 우심실비대, 신장 기형, 항문 이상,","특정한 원인 없이 무작위로 일어남, 가족력이 있는 경우 상염색체 우성 또는 상염색체 열성으로 유전"
65dc48feda45daab46acd604,잠복안구증후군,Isolated cryptophrhalmia,잠재안구,상염색체우성유전
65dc4900da45daab46acd606,입-얼굴-손발 증후군,모흐 증후군\n(Mohr Syndrome)\n입-얼굴-손발가락 증후군\n(OFD Syndrome(Oral Facial Digital Syndrome))\n입-얼굴-손발가락 증후군\n(Oral-Facial-Digital Syndrome)\n입얼굴손발가락 증후군\n(Orofaciodigital Syndrome),"입천장갈림증(구개열), 얼굴과 손과 발의 기형, 팔과 다리의 길이가 짧음, 지적장애, 설소대의 과도한 성장, 넓은 코, 작은 콧구멍, 내안각주름, 외사시, 갈라진 혀, 갈라진 턱, 작은 턱, 구순열, 두눈먼거리증, 탈모증, 모난 귀, 치아의 부정교합, 물가퀴 손가락 및 발가락, 내반족, 발작, 경련성 움직임 및 틱(tic), 말하기와 운동 조절의 발달 장애, 성장 지연, 심장 기형, 신장 기형, 오목 가슴, 호흡계 감염의 취약성","입-얼굴-손발가락 증후군 타입 1은 X 염색체(Xp22.3-p22.2)에 위치하는 CXORF5 유전자의 돌연변이, X- 연관 우성 형질(OFDS type I, OFDS type VII), X- 연관 열성 형질(OFDS type VIII), 상염색체 우성 형질(OFDS type VII), 상염색체 열성 형질(OFDS type II, OFDS type III, OFDS type IV, OFDS type V, OFDS type VI, OFDS type IX)로 유전적으로 매우 다양하다(Heterogeneity)."
65dc4903da45daab46acd608,고린-샤우드리-모스 증후군,Craniofacial Dysostosis-PD Arteriosus-Hypertrichosis-Hypoplasia of Labia\nCraniosynostosis-Hypertrichosis-Facial and Other Anomalies\nGCM Syndrome,"두개골유합증으로 인한 단두증, 소안구증, 치아결핍, 다모증, 성장지연, 저신장, 지능저하","상염색체 열성 유전, 원인유전자는 밝혀지지 않음"
65dc4905da45daab46acd60a,카펜터 증후군,없음,"두개골유합, 뾰족머리, 평평한 콧등, 눈가가 밑으로 쳐지는 down-slanting palpebral fissures, 손발가락의 이상 (피부합지증, 단지증, 다지증 등), 발달장애, 생식샘 저하증, 비만, 배꼽탈장, 청각상실 등",상염색체 열성
65dc490ada45daab46acd60c,첨두유합지증,"뾰족머리손발가락붙음증\n(Acrocephalopolysyndactyly Syndrome)\n아퍼트 증후군\n( Apert Syndrome)\n아퍼트-크루즌 증후군\n( Apert-Crouzon disease)\n뾰족머리손발가락 붙음증 (뾰족머리다합지증)\n( ACS I)\n뾰족머리손발가락 붙음증 I형\n( Acrocephalosyndactyly, Type I)\n손가락붙음형 뾰족머리\n( Syndactylic Oxycephaly)","머리가 비정상적으로 위로 뾰족하게 솟은 모양, 사시, 구개열, 부정교합, 청력손상, 후비공폐색증, 지적장애, 벙어리장갑모양의 손, 발가락합지증, 심장기형, 식도폐쇄증, 근 골격계의 이차 변형","새로운 유전적 돌연변이가 무작위로 일어남, 상염색체 우성으로 유전"
65dc490dda45daab46acd60e,첨두다지유합증,Noack syndrome (Type I)\nCarpenter syndrome (Type II)\nSakati syndrome (Type III)\nGoodman syndrome (Type IV),"첨두, 다지융합증",Noack syndrome - Pfeiffer syndrome (Type I) – 상염색체 우성 유전\nCarpenter syndrome (Type II) – 상염색체 열성 유전\nSakati syndrome (Type III) – 상염색체 우성 유전\nGoodman syndrome (Type IV).- 상염색체 우성 유전
