	research_title	research_subject
2408	침윤성 유두 선종증 2예 = Two Cases of Erosive Adenomatosis of the Nipple	Erosive adenomatosis of the nipple ;  Nipple adenoma
2409	만성 중이염 환자에서 동반된 측두골 수막류 1례 = Unexpected temporal bone meningocele herniation in a case of chronic otitis media	Meningocele ;  Otitis media ;  Temporal bone
2410	Clinical and laboratory differences between early-onset and late-onset adult atopic dermatitis = Clinical and laboratory differences between early-onset and late-onset adult atopic dermatitis	Adult atopic dermatitis ;  Early onset atopic dermatitis ;  Late onset atopic dermatitis
2411	눈근육마비편두통 3예 = Three Cases of Ophthalomplegic Migraine	Headache ;  Transient diplopia ;  Ophthalomplegic Migraine
2412	모공성 홍색 비강진 30예 대한 임상적 및 병리 조직학적 고찰 = A Clinical and Histopathologic Study of Pityriasis Rubra Pilaris모공성 홍색 비강진 30예 대한 임상적 및 병리 조직학적 고찰	Pityriasis Rubra Pilaris ;  Griffiths classification ;  Clinical and histopathological study
2413	Three Korean patients with Cant&uacute; syndrome caused by mutations in ABCC9 and their clinical manifestations	Cant&uacute ;  syndrome ;  Hypertrichosis ;  Macrocephaly ;  Hypertrophic cardiomyopathy ;  ABCC9
2414	간의 미만성 섬유화와 지방변성을 보인 Prater-Willi 증후군 = Chronic Sclerosing Hyaline Change and Fatty Metamorphosis Resembling Alcoholic Liver Disease in Prader-Willi Syndrome	Prader-Willi syndrome ;  Fatty liver ;  Obesity ;  Chronic sclerosing hyaline disease ;  Liver
2415	P065 : Topical tretinoin treatment for confluent and reticulated papillomatosis = P065 : Topical tretinoin treatment for confluent and reticulated papillomatosis	Confluent and reticulated papillomatosis ;  Retinoid ;  Topical ;  Treatment ;  Tretinoin
2416	FC 2-6 : Therapeutic response of dupilumab on systemic and vascular inflammation in patients with atopic dermatitis: Feasibility study using <sup>18</sup>Ffluorodeoxyglucose PET/CT = FC 2-6 : Therapeutic response of dupilumab on systemic and vascular inflammation in patients with atopic dermatitis: Feasibility study using <sup>18</sup>Ffluorodeoxyglucose PET/CT	Atopic dermatitis ;  Dupilumab ;  PET/CT
2417	한국에서의 원발성 담즙성 간경변증 = Primary Biliary Cirrhosis in Korea	Primary biliary cirrhosis ;  Clinical characteristics ;  Korea
2418	누낭에 발생한 원발성 악성흑색종 2예 = Two Cases of Primary Malignant Melanoma of Lacrimal Sac	원발성 악성흑색종 ;  누낭 ;  면역조직화학적 염색 ;  전자현미경 ;  Malignant melanoma ;  Lacrimal sac ;  Immunohistochemical staining ;  Electron microscopy
2419	심부정맥 혈전증 환자에서 Enoxaparin 치료 중 발생한 지연형 과민반응 = A Case of Delayed Hypersensitivity to Enoxaparin in Patient with Deep Vein Thrombosis	Deep vein thrombosis ;  Delayed hypersensitivity ;  Enoxaparin
2420	갑상선에 발생한 원발성 편평상피세포암종 = PRIMARY SQUAMOUS CELL CARCINOMA OF THE THYROID GLAND : CASE REPORT	Squamous cell carcinoma ;  Thyroid gland
2421	[P469] A case of Nicolau syndrome following diclofenac sodium injection = [P469] A case of Nicolau syndrome following diclofenac sodium injection	Diclofenac sodium ;  Nicolau syndrome
2422	Pseudotumoral Presentation of Cerebral Amyloid-Beta Angiopathy: Case Report and Review of Literature	Cerebral amyloid angiopathy ;  Pseudotumoral ;  Tumor-like ;  Neoplasm
2423	조기위암 및 담석과 하지색전증을 수반한 복부대동맥류 1예 = Abdominal Aortic Aneurysm Associated with Early Gastric Cancer, Gall Stone and Peripheral Vascular Embolism	Abodminal aortic aneurysm ;  Early gastric cancer ;  Gall stone ;  Embolism
2424	간문부 담관암과 유사한 소견을 보인 면역글로불린 G4 연관 경화성 담관염 = Immunoglobulin G4-associated Sclerosing Cholangitis Mimicking Hilar Cholangiocarcinoma	Immunoglobulin G4 ;  Sclerosing cholangitis ;  Cholangiocarcinoma ;  Autoimmune pancreatitis
2425	A Case of Successful Treatment of Refractory Synovitis Acne Pustulosis Hyperostosis Osteitis (SAPHO) Syndrome with Adalimumab	SAPHO syndrome ;  Treatment ;  Adalimumab
2426	Clinicopathologic Manifestations of 36 Korean Patients with Acute Generalized Exanthematous Pustulosis: A Case Series and Review of the Literature = Clinicopathologic Manifestations of 36 Korean Patients with Acute Generalized Exanthematous Pustulosis: A Case Series and Review of the Literature	Acute generalized exanthematous pustulosis ;  Clinicopathologic manifestation ;  Korean
2427	Prenatal Persistence of Bilateral Dorsal Edema of Feet Revealed Congenital Venous Malformation: A Case Report = Prenatal Persistence of Bilateral Dorsal Edema of Feet Revealed Congenital Venous Malformation: A Case Report	Sirolimus ;  Prenatal diagnosis ;  Vascular malformations ;  Prenatal ultrasonic diagnosis ;  Edema
2428	악하선에 발생한 방선균증 = Actinomycosis of Submandibular Gland	actinomycosis ;  submandibular gland
2429	골연화증과 저인산혈증을 유발한 인산뇨성 간엽성 종양 -증례 보고- = Osteomalacia and Hypophosphatemia Caused by Phosphaturic Mesenchymal Tumor Mixed Connective Tissue Variant (PMTMCT) -A Case Report-	종양성 골연화증 ;  인산뇨성 간엽성 종양 ;  인산뇨 ;  저인산혈증 ;  정상 혈청 칼슘
2430	Pilomatricoma Combined with Epidermoid Cyst	Pilomatricoma ;  Epidermoid cyst
2431	다발성 골수종으로 이행한 단일형질세포종 1예 = A case of Multiple myeloma arising from solitary plasmacytoma	Solitary plasmacytoma ;  Multiple myeloma
2432	Haddad syndrome 환아의 전신마취 하 치아우식 치료 = 증례보고	Haddad syndrome ;  Congenital Central hypoventilation syndrome ;  Hirschsprung’s disease ;  Dental treatment ;  General anesthesia
2433	[P261] White islands in a sea of red: Dengue fever = [P261] White islands in a sea of red: Dengue fever	Dengue ;  Exanthema
2434	[P233] A case of acquired trichorrhexis nodosa with iron deficiency anemia = [P233] A case of acquired trichorrhexis nodosa with iron deficiency anemia	Trichorrhexis Nodosa ;  Iron Deficiency Anemia
2435	다발성 신경섬유중과 동반된 뇌지주막 낭종 1례  :  증례보고 = Neurofibromatosis Combined With Arachnoid Cyst	Neurofibromatosis type 1 ;  Arachnoid cyst
2436	[P325] A case of nevoid basal cell carcinoma syndrome (gorlin-goltz syndrome) = [P325] A case of nevoid basal cell carcinoma syndrome (gorlin-goltz syndrome)	Basal cell carcinoma ;  Gorlin-Goltz syndrome ;  Nevoid basal cell carcinoma syndrome
2437	상악골에 발생한 Monostotic 섬유성 이형성증의 1례 = A case of Monostotic Fibrous Dysplasia of Maxillary Bone	Fibrous dysplasia ;  Maxilla
2438	P289 : Analysis of dermatologic consultations in psychiatric adolescent inpatient = P289 : Analysis of dermatologic consultations in psychiatric adolescent inpatient	Adolescent ;  Dermatologic consultation ;  Psychocutaneous disorder
2439	장쇄 지방산 산화 장애와 치료적 접근법 = Long-chain Fatty Acid Oxidation Disorders and Therapeutic Approach	Long-chain fatty acid oxidation disorders ;  ${\beta}$-oxidation ;  Triheptanoin ;  Hypoketotic hypoglycemia ;  Cardiomyopathy ;  Rhabdomyolysis
2440	흉부 대동맥확장증의 비중재치료 및 정기적인 검사 = Periodic Surveillance and Medical Management of Thoracic Aortic Aneurysm	흉부 대동맥류 ;  정기검사 ;  약물치료 ;  Aortic aneurysm ;  Thoracic ;  Surveillance ;  Medication therapy management
2441	Propylthiouracil 복용 후 발생한 ANCA positive RPGN = A Case of ANCA-positive RPGN after Propylthiouracil Treatment	Propylthiouracil ;  Glomerulonephritis ;  ANCA
2442	성인 척추에 발생한 호산구성 육아종  :  1례 보고 Report of a Case = Eosinophilic Granuloma of the Adult Spine	Eosinophilic granuloma ;  Adult ;  Thoracic spine
2443	제왕절개술 후 발생한 산후 난소 정맥 혈전증 = A Case of Postpartum Ovarian Vein Thrombosis after Cesarean Section	Ovarian vein ;  Thrombosis ;  Cesarean section ;  난소 정맥 ;  혈전증 ;  제왕절개술
2444	Detection of a Novel Missense Mutations in Atrichia with Papular Lesions = Detection of a Novel Missense Mutations in Atrichia with Papular Lesions	Alopecia universalis ;  Atrichia with popular Lesions ;  Hairless gene ;  Missense mutation
2445	Differentiation between Spinal Intramedullary Astrocytoma and Spinal Multiple Sclerosis Using Clinical and Radiologic Factors	Astrocytoma ;  Diagnosis ;  differential ;  Multiple sclerosis ;  Spinal cord ;  Spine
2446	초극소 저출생 체중아에서 유로키나제로 치료한 심동맥혈전증 1례 = Urokinase Treatment of Deep Artery Thrombosis in Extremely Low Birth Weight Infant	혈전증 ;  유로키나제 ;  초극소 저출생 체중아 ;  Thrombosis ;  Receptors ;  Urokinase plasminogen activator ;  Infant ;  Extremely low birth weight
2447	젊은 여성의 목에 발생한 탄력섬유거짓황색종양 유두진피 탄력섬유용해증 = A Case of Pseudoxanthoma Elasticum-Like Papillary Dermal Elastolysis on the Neck of a Young Woman	Elastolytic disorder ;  Intrinsic aging ;  Pseudoxanthoma elasticum-Like papillary dermal elastolysis
2448	소아에서 발생한 직장구불결장의 분절확장에 대한 Laparoscopic-Assisted Transanal Endorectal Pull-Through 술식 = Laparoscopic-Assisted Transanal Endorectal Pull-Through for Segmental Dilatation of Rectosigmoid Colon in a Child	Segmental dilatation ;  Rectosigmoid ;  Child
2449	자궁경부에서 발생한 림프상피양 암종 = A case of Lymphoepithelioma-Like carcinoma of the uterine cervix	림프상피양 암종 ;  자궁경부 ;  Lymphoepithelioma-Like carcinoma ;  LELC ;  Uterine cervix
2450	유두부 종양의 진단과 치료에서 내시경의 역할 = The Role of Endoscopy in Diagnosis and Treatment of Ampullary Tumor	십이지장 유두부 종양 ;  십이지장 유두부 선종 ;  십이지장 유두부 선암 ;  내시경 유두 절제술 ;  Ampullary tumor ;  Ampullary adenoma ;  Ampullary cancer ;  Endoscopic papillectomy
2451	[P042] Primary localized cutaneous nodular amyloidosis on the scalp successfully removed with staged excision = [P042] Primary localized cutaneous nodular amyloidosis on the scalp successfully removed with staged excision	Amyloidosis ;  PLCNA ;  Staged excision
2452	혈액종양 ; 광범위 하지 병변을 동반한 원발성 피부 역형성 대세포 림프종 1예 = Hemato-oncology ; A Case of Primary Cutaneous Anaplastic Large Cell Lymphoma with Extensive Limb Disease	Lymphoma ;  Primary cutaneous anaplastic large cell
2453	[P298] A case of disseminated molluscum contagisum in an immunocompetent adult following treatment with tolpical calcipotriol and steroid = [P298] A case of disseminated molluscum contagisum in an immunocompetent adult following treatment with tolpical calcipotriol and steroid	Disseminated mollusucm contagiosum ;  Tolpical calcipotriol and steroid
2454	다발성 연골육종 1례 보고 = Multicentric Chondrosarcoma - case report -	Chondrosarcoma ;  Multicentric
2455	[P029] A case of miliary osteoma cutis on face = [P029] A case of miliary osteoma cutis on face	Osteoma cutis ;  Milary osteoma cutis
2456	근위부 담도암의 임상적 고찰 = Clinical Study on Proximal Cholangiocarcinoma근위부 담도암의 임상적 고찰	Proximal bile duct ;  Clonorchis sinensis ;  Cholangiocarcinoma
2457	정상 위 분문부 점막에서 발견된 이소성 골 형성 = Heterotopic bone formation in normal gastric cardiac mucosa	Heterotopic ossification ;  Stomach
2458	췌장 낭성 종양의 임상적 고찰 = Pancreatic Cystic Neoplasms : A Clinical Review췌장 낭성 종양의 임상적 고찰	Pancreatic cystic neoplasm ;  CEA.
2459	혈청학적 및 세균학적으로 진단된 Leptospira 중 7 예 - 급성호흡부전증을 중심으로 - = Seven Cases of Leptospirosis Diagnosed by Serology and Bacteriology혈청학적 및 세균학적으로 진단된 Leptospira 중 7 예 - 급성호흡부전증을 중심으로 -	Leptospirosis ;  Dyspnea ;  ARDS
2460	Macular Hole as a Risk Factor of Choroidal Detachment in Rhegmatogenous Retinal Detachment	Choroidal detachment ;  Macular hole ;  Retinal detachment
2461	증례(症例) : 젊은 남자에서 발생한 심한 특발성 골다공증 1례 = A case of severe idiopathic osteoporosis in young male	idiopathic osteoporosis ;  secondary osteoporosis
2462	광범위한 심부 정맥계의 경색：후두개와 수술 후 발생한 드문 합병증 = Extensive Infarction of the Deep Cerebral Venous System：Unusual Complication Following the Surgery in the Posterior Fossa	Deep venous sytem ;  Infarction ;  Infection ;  Postoperative ;  Vestibular schwannoma
2463	Case report : SIADH Associated with Prostate Cancer	Prostatic neoplasm ;  Inappropriate ADH syndrome ;  Hyponatremia
2464	저혈당증과 태변 흡인 증후군을 보인 신생아에서나타난 피하지방괴사 1례 = A Case of Subcutaneous Fat Necrosis of the Newborn with Hypoglycemia and Meconium Aspiration Syndrome	피하지방괴사 ;  신생아 ;  저혈당증 ;  태변 흡인 증후군 ;  Fat necrosis ;  Newborn ;  Hypoglycemia ;  Meconium aspiration syndrome
2465	두개내고름집을 유발한 자궁관난소고름집 = A case of intracranial abscess following the tubo-ovarian abscess	난소 ;  뇌고름집 ;  골반내감염 ;  Ovary ;  Brain abscess ;  Pelvic inflammatory disease
2466	복막에 발생한 난황낭종양의 = Primary Yolk Sac Tumor of Omentum A Case Report	난황낭종양 ;  생식세포종양 ;  복막 ;  Yolk sac tumor ;  Germ cell tumor ;  Omentum
2467	Treatment Response to Acquired Aphasia with Seizures and Prognosis through Electroencephalogram on Cognitive Function	Aphasia ;  Landau-Kleffner syndrome ;  Epilepsy
2468	산전검사를 시행하지 않은 산모에서 태어난 신생아의단순 포진 바이러스 2형 뇌염 1례 = A Case of Herpes Simplex Virus Type 2 Encephalitis of a Newborn Delivered by a Mother without Prenatal Screening	단순포진 ;  신생아 ;  뇌염 ;  Encephalitis ;  Herpes Simplex ;  Newborn
2469	악하부 농양으로 발병한 육아종증 다발 혈관염 1예 = A Case of Granulomatosis with Polyangiitis with Submandibular Abscess as Primary Manifestation	Granulomatosis with polyangiitis ;  Submandibular gland
2470	비출혈을 동반한 외상성 내경동맥 가성동맥류 1례 : Detachable Coil에 의한 색전술 = A case of traumatic pseudoaneurysm of the internal carotid artery accompanying massive epistaxis: treated with detachable Coil	비출혈 ;  외상성 가성동맥류
2471	주타액선 종양의 임상적 고찰 = A Clinical Analysis of Major Salivary Gland Tumors	Major salivary gland tumor ;  주타액션 종양
2472	만성 B형 바이러스 간염과 연관된 범발형 백반증 = Vitiligo Universalis Associated with Chronic Hepatitis B	Chronic viral hepatitis B ;  Vitiligo universalis
2473	맹장부 및 상행 결장의 게실 질환에 대한 임상적 고찰 = Clinical Analysis of Diverticulosis of the Cecum and Ascending Colon	Diverticulosis ;  Cecum ;  Ascending colon ;  Diverticulitis
2474	Case Report : Complete Recovery of Renal Function in Bilateral Renal Cortical Necrosis = Case Report : Complete Recovery of Renal Function in Bilateral Renal Cortical Necrosis	Renal cortical necrosis ;  Bilateral ;  Kidney failure ;  Acute
2475	Primary Cutaneous CD4+ Small/Medium-sized Pleomorphic T-cell Lymphoma = A Case of Primary Cutaneous CD4+ Small/Medium-sized Pleomorphic T-cell Lymphoma	CD4 ;  CHOP chemotherapy ;  Lymphoma ;  Pleomorphic ;  Small/medium-sized
2476	구강편평태선에서 발생한 편평세포암 = A Case of Squamous Cell Carcinoma Originating from Oral Lichen Planus	Biopsy ;  Lichen planus ;  Malignant transformation ;  Oral lichen planus ;  Squamous cell carcinoma
2477	비강 및 부비동 진균증의 임상적 고찰 = Mycotic Infliction of the Nasal Cavity and Paranasal Sinus	Nose ;  Paranasal sinus ;  Fungal infection(Aspergillosis ;  Mucormysocis)
2478	폐암의 피부전이의 유병률 조사와 임상 및 병리조직학적 연구 = Prevalence and Clinicopathological Features of Cutaneous Metastasis from Lung Cancer in Korea폐암의 피부전이의 유병률 조사와 임상 및 병리조직학적 연구	Cutaneous metastasis ;  lung cancer
2479	증례보고 : 폐외 결핵농양 환자의 기관내 삽관 중 발견된 후두개결핵 의증 = A case report : Tuberculosis Like Lesion on the epiglottis of a patient with an extrapulmonary tuberculosis abscess	Epiglottic tuberculosis ;  Extrapulmonary involvement ;  Immune suppression
2480	복부 대동맥류 수술 후에 발생한 거대세포 바이러스 감염과 연관된 자발성 장천공과 대동맥-십이지장루 출혈 2예 = Cytomegalovirus Infection-related Spontaneous Intestinal Perforation and Aorto-enteric Fistula after Abdominal Aortic Aneurysmal Repair	Abdominal aortic aneurysm ;  Bleeding ;  Cytomegalovirus ;  Peptic ulcer ;  Perforation
2481	증례 : 혈액종양 ; 필라델피아 양성 급성골수성 백혈병에서 imatinib mesylate 투여로 완전관해 유도된 1예 = Hemato-oncology ; Complete remission of philadelphia chromosome-positive acute myeloid Leukemia with imatinib mesylate	Leukemia ;  Myeloid ;  Acute ;  Philadelphia chromosome ;  Imatinib mesylate
2482	동기능부전증후군과 동반된 지속성 좌상대정맥 = Persistent Left Superior Vena Cava Combined with Sick Sinus Syndrome	Persistent left superior vena cava ;  Cardiac electrical instability ;  Echocardiography
2483	태아 뇌실내 출혈을 동반한 선천성 수두증 = A Case of congenital hydrocephalus associated with fetal intraventricular hemorrhage	선천성 수두증 ;  태아 뇌출혈 ;  출혈성 수두증 ;  Congenital hydrocephalus ;  Fetal intraventricular hemorrhage ;  Post-hemorrhagic hydrocephalus
2484	Paget씨 병에 동반되어 양측 상악골에서 발견된 거대세포종 1례 = A Case of Giant Cell Tumor of Bilateral Maxilla with Paget's Disease	거대세포종 ;  Paget씨 병 ;  상악골 ;  Giant cell tumor ;  Maxilla ;  Paget's disease
2485	패혈증을 동반한 Clostridium 간농양 = A Case of Clostridium Liver Abscess with Sepsis	Clostridium ;  Liver abscess ;  Sepsis
2486	Diclofenac 주사 후 발생한 Nicolau 증후군 = Embolia Cutis Medicamentosa Following Intramuscular Injection of Diclofenac	Diclofenac ;  Nicolau syndrome
2487	A Case of Extremely Very Late Stent Thrombosis 8 Years after Implantation of Drug-Eluting Stent Observed by Intravascular Ultrasound	Coronary artery stent thrombosis ;  Very late stent thrombosis ;  Drug-eluting stent ;  Percutaneous coronary intervention
2488	S-579 : Hyperferritinemia of pseudo-pseudo Meigs`s syndrome in lupus patients = S-579 : Hyperferritinemia of pseudo-pseudo Meigs`s syndrome in lupus patients	Lupus ;  Meigs` syndrome ;  CA-125
2489	Desmoplastic Small Round Cell Tumor of the Sigmoid Colon  :  A Case Report	Sarcoma ;  Small cell ;  Colon ;  Rhabdoid tumor
2490	내과적 치료로 회복된 급성 췌장염에 병발된 간문맥 내 가스 = A Case of Successful Treatment of Portal Venous Gas Caused by Acute Pancreatitis	Hepatic portal vein ;  Superior mesenteric vein ;  Gas ;  Acute pancreatitis
2491	후천면역결핍증후군 환자에서 발생한 악성 매독 = Malignant Syphilis in an Acquired Immune Deficiency Syndrome Patient	AIDS ;  Malignant syphilis ;  Noduloulcerative Lesions
2492	삼일열 말라리아에 의한 말라리아 간염 = A Case of Malarial Hepatitis by Plasmodium Vivax	Vivax ;  Malaria ;  Hepatitis ;  Jaundice
2493	Characteristics and dental considerations of patients with Sotos syndrome	Sotos syndrome ;  Dental anomaly ;  Hypodontia
2494	몸백선을 닮은 고리매독진 = Annular Syphilid Mimicking Tinea Corporis	Annular syphilid ;  Tinea corporis
2495	신전성 급성 신손상으로 오인된 급성 진행성 길랑-바레 증후군 1예 = A case of rapidly progressive Guillain-Barre syndrome confused as acute kidney injury of prerenal type	acute kidney injury ;  Guillain-Barre syndrome
2496	비소퇴성 선천혈관종 3예 = Three Cases of Noninvoluting Congenital Hemangioma	Congenital hemangioma ;  GLUT-1 ;  Hemangioma ;  Noninvoluting congenital hemangioma
2497	원발성 이하선 편평상피세포암종 = Primary Squamous Cell Carcinoma of the Parotid Gland	Parotid gland ;  Malignant salivary gland tumor ;  Primary squamous cell carcinoma
2498	성대마비를 동반한 Ramsay Hunt 증후군 1예 = A Case of Ramsay Hunt Syndrome with Vocal Cord Paralysis	Ramsay Hunt syndrome ;  Vocal cord paralysis
2499	미 FDA의 신약허가 취득을 위한 전략적 접근 방법에 관한 고찰	FDA-사전면담 ;  생물학적 제제 ;  희귀질환 ;  희귀질환치료제 ;  FDA-sponsor meeting ;  biologics ;  rare disease ;  orphan drug ;  505(b)(2)조항 ;  505(b)(2) application
2500	신생아 위 자연천공에 대한 임상적 고찰 = Clinical Review of Spontaneous Gastric Perforation in the Newborn	Gastric perforation ;  Spontaneous ;  Neonate
2501	재발한 급성 파종성 뇌척수염 1례 = A Case of Recurrent Acute Disseminated Encephalomyelitis	Acute disseminated encephalomyelitis ;  Recurrent
2502	성경험이 없는 52세 여성에서 발생한 투명세포 선암 = A Case of Clear Cell Adenocarcinoma in The Uterine Cervix of 52-Year-Old Virgin	투명세포선암 ;  디에틸스틸베스트롤 ;  성경험이 없는 여성 ;  Clear cell adenocarcinoma ;  Diethylstilbestrol ;  Virgin
2503	신증후 출혈열 환자에서 동반된 스트레스성 심근병증 = A Case of Hemorrhagic Fever with Renal Syndrome with Stress-induced Cardiomyopathy	Hemorrhagic fever with renal syndrome ;  Stress ;  Cardiomyopathy
2504	Case Reports : A Case of Hypothermia Combined with Systemic Lupus Erythematosus	Antiendothelial cell antibody ;  Kidney transplantation ;  Graft rejection ;  acute
2505	복강경하 근치적 신절제술 후에 발생한 급성 신부전을 동반한 횡문근 융해증 = A Case Report of Rhabdomyolysis Associated With Acute Renal Failure Following Laparoscopic Radical nephrectomy	Rhabdomyolysis ;  Acute renal failure ;  Laparoscopy ;  Nephrectomy
2506	가족적으로 발생한 원발 피부아밀로이드증 = Primary Cutaneous Amyloidosis with Familial Background	Amyloidosis ;  Familial
2507	전신홍반루푸스와 이차성 항인지질항체 증후군에 동반된 타카야수동맥염 = A Case of Takayasu`s Arteritis Associated with Systemic Lupus Erythematosus and Secondary Antiphospholipid Syndrome	Takayasu`s arteritis ;  Systemic Lupus erythematosus ;  Secondary antiphospholipid syndrome
2508	경부외상 후에 발생한 후척수동맥 경색 1예 = A Case of Posterior Spinal Artery Infarction after cervical Trauma	Spinal cord ;  Infarction ;  Posterior inferior cerebellar artery syndrome ;  Dissection ;  Trauma
2509	폐경기 여성에서 고름자궁으로 나타난 자궁내막결핵 증례 = A case of postmenopausal pyometra caused by endometrial tuberculosis	폐경기 ;  고름자궁 ;  자궁내막결 Postmenopausal ;  Pyometra ;  Endometrial tuberculosis
2510	비호지킨 림프종의 안와 부속기 침범으로 인한 완전 눈꺼풀처짐 1예 = Complete Ptosis Caused by Ocular Adnexal Involvement of Non-Hodgkin lymphoma: A Case Report	Complete blepharoptosis ;  Diffuse large B-cell lymphoma ;  Non-hodgkin lymphoma ;  Orbital lymphoma
2511	A Generalized Lichen Planus Following COVID-19 Vaccination: A Case Report = A Generalized Lichen Planus Following COVID-19 Vaccination: A Case Report	Case report ;  ChAdOx1 nCoV-19 ;  COVID-19 vaccine ;  Lichen planus ;  Oxford-AstraZeneca COVID vaccine
2512	댄디워커 기형이 동반된 선천성 인지 조갑 이형성증 = A Case of Congenital Onychodysplasia of the Index Fingers Associated with Dandy-Walker Variant	Congenital onychodysplasia of the index fingers ;  Dandy-Walker variant
2513	만성 알코올 중독 환자에서 Staphylococcus lugdunensis에 의해 발생한 Botryomycosis = A Case of Botryomycosis Caused by Staphylococcus lugdunensis in a Chronic Alcoholic	Botryomycosis ;  Staphylococcus lugdunensis
2514	Two cases of bronchobiliary fistula = Case report	Bronchobiliary fistula ;  PTBD
2515	증례 : 호흡기 ; Folliculin 유전자 변이로 진단된 Birt-Hogg-Dube 증후군 1예 = Case Reports : Pulmonology ; A Case of Birt-Hogg-Dube Syndrome Diagnosed by a Folliculin Gene Mutation	Birt-Hogg-Dube 증후군 ;  Folliculin 유전자 ;  폐질환 ;  Lung disease ;  Gene deletion ;  Pneumothorax
2516	뾰족 콘딜로마의 임상 양상을 보인 여성의 외음부에 발생한 후천성 국한성 림프관종 = Short Report : Acquired Lymphangioma Circumscriptum of the Vulva Mimicking Condyloma Acuminatum	Acquired Lymphangioma circumscriptum ;  Cervical cancer ;  Condyloma acuminatum ;  Vulva
2517	크론병 환자와 가족에서 장투과성의 변화 = Intestinal Permeability in Patients with Crohn	장투과성 ;  크론병 환자의 직계가족 ;  Intestinal permeability ;  Crohn's disease
2518	자궁경부에 발생한 T/Natural killer cell 림프종 = A Case of T/Natural Killer Cell Lymphoma of the Uterine Cervix	T/NK cell 림프종 ;  자궁경부 ;  T/NK cell Lymphoma ;  Uterine cervix
2519	가역성 양측 기저핵 병변을 동반한 반복적인 급성 요독성 뇌병증 = Recurrent Acute Uremic Encephalopathy Associated with Reversible Bilateral Basal Ganglia Lesion	Diabetic nephropathy ;  Uremia ;  Basal ganglia
2520	Neuropathic Arthropathy of the Shoulder Associated with Cervical Syringomyelia = A Case Report	Shoulder ;  Neurogenic arthropathy ;  Cervical syringomyelia
