	research_title	research_subject
804	지도모양 혀와 균열 혀를 동반한 전신성 농포성 건선 2예 = Two Cases of Combined Geographic Tongue and Fissured Tongue in Generalized Pustular Psoriasis	Fissured tongue ;  Generalized pustular psoriasis ;  Geographic tongue
805	소아에서의 간종양 = Liver Tumors in Children	Liver tumor ;  Children
806	산발적으로 발생한 급성 E형 간염 3예 = Three Sporadic Cases of Acute Hepatitis E	Acute hepatitis E ;  IgM anti-HEV ;  Hepatits E virus
807	거대한 간내 혈종을 주소로 내원한 간세포암종 환자 = A Case of Hepatocellular Carcinoma Presented as a Huge Intrahepatic Hematoma	Hepatocellular carcinoma ;  Hematoma
808	쇼그렌 증후군에 동반된 막증식성 사구체신염 = A Case of Membranoproliferative Glomerulonephritis Associated with Sjogren`s Syndrome	Membranoproliferative glomerulonephritis ;  Proteinuria ;  Sjogrens syndrome ;  Vasculitis
809	갑상선종으로 오인된 경부 임파선 만성 방선균증 = Chronic Actinomycosis of the Cervical Lymph Node Simulating a Thyroid Neoplasm	Actinomycosis ;  Cervicofacial ;  Lymph node ;  Actinomycosis ;  Cervicofacial ;  Lymph node ;  방선균증 ;  경안면부 ;  림프절
810	낮은 류마티스관절염 질병활성도를 동반한 불응성 Felty 증후군에서 Rituximab의 치료 = Treatment with Rituximab in a Patient with Refractory Felty Syndrome and Low Rheumatoid Arthritis Disease Activity A Case Report	Felty syndrome ;  Rituximab ;  Rheumatoid arthritis
811	Case Report : A Case of Obstructive Jaundice Caused by Paradoxical Reaction during Antituberculous Chemotherapy for Abdominal Tuberculosis = Case Report : A Case of Obstructive Jaundice Caused by Paradoxical Reaction during Antituberculous Chemotherapy for Abdominal Tuberculosis	Paradoxical reaction ;  Periportal Lymphadenitis ;  Abdominal tuberculosis
812	Thyroid Nodule Requiring Thyroidectomy in a Patient with Thyroid Hemiagenesis	Thyroid hemiagenesis ;  Thyroidectomy ;  Thyroid nodule
813	해조류 유래 호흡기 질환 천식 치료제 연구 동향	Astham ;  Marine algae ;  Algae-derived therapeutic agents
814	선상태선 환자에서 0.1% Tacrolimus 연고의 임상적 치료 효과 = Clinical Effects of 0.1% Tacrolimus Ointment for the Treatment of Lichen Striatus선상태선 환자에서 0.1% Tacrolimus 연고의 임상적 치료 효과	Lichen striatus ;  Tacrolimus
815	PHOX2B유전자의 27 다염기반복 돌연변이를 가진 Haddad증후군 = Haddad Syndrome with 27 Polyalanine Repeats in PHOX2B Gene in a Korean Infant	Haddad 증후군 ;  선천성 중추성 무호흡 증후군 ;  선천성 거대 결장증 ;  PHOX2B 유전자 ;  단장 증후군 ;  Congenital central hypoventilation syndrome ;  Hirschsprung disease ;  Haddad syndrome ;  PHOX2B Gene ;  Short bowel syndrome
816	베게너 육아종증 환자에서 발생한 대장염 = A Case of Wegener`s Granulomatosis with Colitis	Wegener`s granulomatosis ;  Colitis ;  Gastrointestinal
817	해설논문 : 급성 간부전: 원인, 예후, 치료 = Review Article : Acute Liver failure in Korea: etiology, prognosis and treatment	급성 간부전 ;  간성뇌증 ;  뇌부종 ;  N-acetylcysteine ;  간이식 ;  Acute Liver failure ;  Hepatic encephalopathy ;  Cerebral edema ;  Liver transplantation
818	소아에 발생된 전신성 경화즐 1례 = A Case of Systemic Sclerosis in a Child	Raynand's phenomenon ;  Systemic sclerosis
819	류마티스관절염으로 오인된 다중심 망상조직구 증식증 = A Case of Multicentric Reticulohistiocytosis Mistaken as Rheumatoid Arthritis	Multicentric reticulohistiocytosis ;  Rheumatoid arthritis ;  Infliximab
820	외이도 진주종 수술후 발생한 두개저 골수염 1예 = A case : Skull Base Osteomyelitis after Mastoidectomy	Skull base osteomyelitis ;  Otitis externa ;  cholesteatoma
821	자궁경부에 발생한 폐포성 횡문근육종 = A case of alveolar rhabdomyosarcoma of the uterine cervix	Rhabdomyosarcoma ;  Uterine cervix ;  Alveolar type ;  폐포성 횡문근육종 ;  자궁경부
822	봉독 면역요법후의 면역학적 변화에 대한 고찰 -알레르기 질환에 응용 가능성을 중심으로- = Immunological Changes on Allergic Response after Beevenom Immunotherapy	beevenom immunotherapy ;  immunological change ;  allergic disease
823	Case Reports : Metastatic Gastric Adenocarcinoma Presenting as a Solitary Plaque on the Palm = Case Reports : Metastatic Gastric Adenocarcinoma Presenting as a Solitary Plaque on the Palm	Cutaneous metastasis ;  Gastric cancer ;  Palm
824	Case Reports : CD20 Positive T Cell Lymphoma Involvement of Skin = Case Reports : CD20 Positive T Cell Lymphoma Involvement of Skin	CD20 ;  T cell Lymphoma ;  T cell receptor gene arrangement
825	Supratentorial Leptomeningeal Hemangioblstoma  :  Case Report	Hemangioblastoma ;  Brain ;  Neoplasms ;  MRI
826	Case Reports : Surgical Treatment for 11 Cases of Penile Verrucous Carcinoma = Case Reports : Surgical Treatment for 11 Cases of Penile Verrucous Carcinoma	Penis ;  Surgery ;  Verrucous carcinoma
827	케톤성 당뇨와 모야모야병으로 인한 허혈성 뇌졸증 동시 발생 = Concurrence of Diabetic Ketoacidosis and Acute Ischemic Stroke due to Moyamoya Disease	Diabetic ketoacidosis ;  Type 2 diabetes mellitus ;  Moyamoya disease
828	급성 담낭염 소견을 보인 담낭 방선균증 1예 = A Case of Actinomycosis of Gallbladder Presenting as Acute Cholecystitis	Actinomycosis ;  Gallbladder ;  Cholecystitis
829	선천성 결장 폐쇄증의 경험 = Clinical Experience with Colonic Atresia	Colon ;  Atresia ;  Diagnosis
830	갑상선 수질암의 단일 기관의 25년간 임상 경험과 RET 원 종양유전자 검사 결과 분석 = Medullary Thyroid Carcinoma: 25-year Experience and the Results of the RET Proto-oncogene Screening Test	갑상선 수질암 ;  질병 관해 ;  예후 ;  RET 원 종양유전자 ;  Medullary thyroid carcinoma ;  Remission ;  Prognosis ;  RET proto-oncogene
831	기저 질환이 없는 환자에서 다량의 흉막 삼출액을 동반한 Mycobacterium-avium complex에 의한 폐질환 1예 = A Case of Mycobacterium avium Pulmonary Disease with Massive Pleural Effusion in an HIV-negative, Nonimmunosuppressed Patient : Using PCR-Restriction Fragment Length Polymorphism Assay	Mycobacterium-avium complex ;  Pleural effusion ;  Restriction Fragment Length Polymorphism Assay
832	성대에 발생한 화농성 육아종 1예 = A Case of Pyogenic Granuloma of Vocal Cords	Pyogenic granuloma ;  Larynx
833	중이강 내시경을 사용한 외림프 누공의 진단 = Transtympanic Endoscopic Diagnosis of Perilymph Fistula	Perilymph fistula ;  Transtympanic endoscopy
834	척수 수질내의 신경초종  :  증례보고 Case Report = Intramedullary Neurilemmoma of the Spine	Intramedullary lesion ;  Schwannoma ;  Spinal cord tumor
835	흉추 척수내 낭미충증 1예 = A Case of Intramedullary Cysticercosis in Thoracic Cord	Cysticercosis ;  Thoracic ;  Intramedullary
836	자발성 척수경막외혈종 = Spontaneous Spinal Epidural Hemorrhage	Spontaneous hemorrhage ;  Unknown ;  Coagulopathy ;  Epidural hematoma ;  Laminectomy
837	원발성 유두 갑상선암의 수술적 치료 후 측경부 전이 림프절에서 발생한 미분화 갑상선암 3예 = Anaplastic Transformation of Metastatic Papillary Thyroid Carcinomas in the Cervical Lymph Nodes: Report of 3 Cases	"미분화 전환 ;  유두 갑상선암 ;  미분화 갑상선암 ;  <FONT FACE=""Arial Narrow"">Anaplastic transformation ;  Papillary thyroid carcinoma ;  Anaplastic thyroid carcinoma"
838	진성 백혈구 무형성증 환자에서 발생한 조직구양 Sweet 증후군 = A Case of Histiocytoid Sweet Syndrome Developed in the Patient with Pure White Cell Aplasia	Histiocytoid Sweet syndrome ;  Myeloperoxidase
839	암과 세계화 : 여성건강에 초점을 둔 유럽의 관점 = Cancer and Globalization: A European Perspective with a Focus on Women's Health	Cancer ;  Globalization ;  Women's Health
840	[P139] Pemphigus vegetans induced by aceclofenac = [P139] Pemphigus vegetans induced by aceclofenac	Pemphigus vegetans ;  NSAIDs-induced pemphigus ;  Aceclofenac
841	경피적 배액술로 치료 가능하였던 상염색체 우성 다낭신 환자의 간낭종 감염 = A case successfully treated with percutaneous drainage of infected hepatic cyst in a patient with adult polycystic kidney disease	Polycystic kidney ;  Autosomal dominant ;  Hepatic cyst infection ;  Percutaneous drainage
842	A family with dynamin 2-related centronuclear myopathy without ocular involvement	Centronuclear myopathy ;  Dynamin II ;  Ophthalmoplegia
843	Salmonella 식중독 후 발생된 성인 용혈성 요독 증후군 1례  :  A Case Report = Hemolytic Uremic Syndrome Associated with Salmonella Food Poisoning in Adult	Hemolytic uremic syndrome ;  Salmonella infection ;  Diarrhea
844	The outbreaks and surveillance of animal rabies in Gangwon-do = The outbreaks and surveillance of animal rabies in Gangwon-do	Rabies ;  Outbreaks ;  Negri bodies ;  Vaccination
845	무균성 뇌수막염을 동반한 Ramsay Hunt 증후군 1례 = A Case of Ramsay Hunt Syndrome with Aseptic Meningitis	Ramsay Hunt syndrome ;  Aseptic meningitis ;  Varicella-zoster virus
846	시상하부 과오종과 연관된 성조숙증을 동반한 신경섬유종증 1예 = A Case Report of Precocious Puberty in Children Associated with Hypothalamic Hamartoma in Neurofibromatosis Type 1	Neurofibromatosis 1 ;  Puberty ;  Precocious ;  Hypothalamic disease ;  Hamartoma
847	간문맥혈전증을 동반한 상장간막정맥혈전증  :  증례보고 = Porto-Mesenteric Venous Thrombosis	간문맥-상장간막정맥혈전증 ;  장경색 ;  Porto-mesenteric venous thrombosis ;  Bowel infarction
848	악관절에 발생한 활액성 연골종증(Synovial Chondromatosis) ; 증례보고 = SYNOVIAL CHONDROMATOSIS OF THE TEMPOROMANDIBULAR JOINT : A CASE REPORT	Synovial chondromatosis ;  Temporomandibular joint
849	경련을 주소로 내원한 폐색전증 2례와 문헌고찰 = Seizure Caused by Pulmonary Embolism Two Cases Report and Review of the Literature	Pulmonary embolism ;  Seizure ;  Hypoxemia
850	뇌량 주위 동맥에 발생한 외상성 뇌 동맥류 1례  :  증례 보고 A Case Report = One Case of Traumatic Pericallosal Artery Aneurysm	Traumatic aneurysm ;  Pericallosal artery ;  MRI
851	두개강내 투명세포성 수막종 수술 및 방사선 치료 후 척추내 원위 재발 : 증례보고 및 문헌 고찰 = Distal recurrence of intraspinal clear cell meningioma after intracranial surgery and adjuvant radiotherapy: A case report and literature review	Clear cell meningioma ;  Metastasis ;  Recurrence
852	피부병변이 선행된 급성골수단구성백혈병 1예 = A Case of Acute Myelomonocytic Leukemia with Initial Manifestations in the Skin	Acute myeloid leukemia ;  Acute myelomonocytic leukemia ;  Leukemia cutis
853	기침으로 초래된 단순 늑골골절 1례 = Case Report of a Simple Rib Fracture Caused by Coughing	Coughing ;  Rib fracture ;  Computed tomography
854	소뇌교각부에 낭종을 형성한 스팔가눔증 = A Case of Parasitic Cyst from Sparganosis in the Cerebellopontine Angle	Sparganosis ;  Parasitic cyst ;  Cerebellopontine angle ;  Retromastoid craniectomy
855	Incidental detection of pancreatic hemangioma mimicking a metastatic tumor of renal cell carcinoma	Pancreas ;  Hemangioma ;  Adult hemangioma ;  Incidental discovery ;  CD34
856	급성 골수성 백혈병에서 이식 편대 숙주반응 치료 중 발생한 노르웨이 옴 = A Case of Norwegian Scabies in Patient with Acute Myeloid Leukemia Associated Graft-versus-host Disease	Acute myeloid Leukemia ;  Graft-versus-host disease ;  Norwegian scabies
857	피부전이를 첫 증상으로 보인 반지세포 위암 = A Case of Signet-ring Cell Gastric Carcinoma of which the First Symptom was Skin Lesions	Cutaneous metastasis ;  Signet-ring cell gastric carcinoma
858	간과된 종격동 갑상선종 = Forgotten Mediastinal Goiter	간과된 종격동 종괴 ;  원발성 종격동 종괴 ;  Forgotten mediastinal goiter ;  Primary mediastinal goiter
859	P244 : Unilesional mycosis fungoides: clinicopathological, immunohistochemical, and molecular features = P244 : Unilesional mycosis fungoides: clinicopathological, immunohistochemical, and molecular features	Photodynamic therapy ;  Unilesional mycosis fungoides ;  Ultraviolet A1
860	전완부 단순 근육 긴장으로 오인한 쇄골 불유합에 의한 늑쇄증후군 -증례 보고- = Costoclavicular Syndrome Secondary to Nonunion of a Displaced Fracture of the Clavicle, Misdiagnosed as a Simple Muscle Strain -A Case Report-	쇄골 ;  단순 근육 긴장 ;  불유합 ;  늑쇄증후군 ;  Clavicle ;  Simple muscle strain ;  Nonunion ;  Costoclavicular syndrome
861	만성 염증성 탈수초 다발성 신경근병증이 동반된 낭창성 신염 = A Case of Chronic Inflammatory Demyelinating Polyneuropathy in Lupas Nephritis	Systemic lupus erithematosus ;  Chro-nic inflammatory demyelinating poly-neuropathy ;  Sural nerve biopsy
862	IVF-ET 임신 중기에 발생한 난소난관농양 = Tuboovarian Abscess in Pregnancy After in Vitro Fertilization And Embryo Transfer	난소난관 농양 ;  난자채취 ;  배아이식 ;  임신 ;  Tuboovarian abscess ;  Pregnancy ;  In vitro fertilization and embryo transfer ;  Oocyte retrieval
863	유방의 침윤성 미세유두모양 암종의 세침흡인 세포학적 소견 - 4예 보고 - = Fine Needle Aspiration Cytology of Invasive Micropapillary Carcinoma of the Breast - Report of four Cases -	Breast ;  Invasive micropapillary carcinoma ;  Fine needle aspiration cytology
864	한국인에서의 다발성 내분비선종증의 특징 = The Characteristics of Multiple Endocrine Neoplasia in Korean	다발성 내분비선종증 ;  배선돌연변이 ;  한국인 ;  Multiple endocrine neoplasm (MEN) ;  Germ-line mutation ;  Korean
865	상행결장에 발생한 종괴형 자연살해 유사 T세포 림프종 = A Case of Fungating Type Natural Killer Like T Cell Lymphoma of the Ascending Colon	Lymphoma ;  T-cell ;  Colon
866	급성 알코올성 췌장염에 의해 유발된 십이지장 벽내혈종 = A Case of Duodenal Intramural Hematoma Caused by Acute Alcoholic Pancreatitis	십이지장 혈종 ;  급성 췌장염 ;  Intramural duodenal hematoma ;  Acute pancreatitis ;  Alcoholic pancreatitis ;  Medical therapy
867	Oculodentodigital syndrome의 1증례 = OCULODENTODIGITAL SYNDROME : A CASE REPORT	Enamel hypoplasia ;  Oculodentodigital syndrome ;  Genetic disease ;  법랑질 형성부전 ;  유전성 질환
868	자발성 척수 경막외 혈종  :  치험 2례 Report of Two Operative Cases = Spontaneous Spinal Epidural Hematoma	Spontaneous spinal epidural hematoma ;  Iopamidol myelography
869	Diffuse Well-Differentiated 림프구형 림프종에 대한 임상적고찰 = Clinical Study of Diffuse Well-Differentiated Lymphocytic Lymphoma	Histologic conversion ;  Diffuse well-differentiated lymphocytic lymphoma
870	급성 골수성 백혈병 환자에서 발생한 부종양성 지방층염 = 급성 골수성 백혈병 환자에서 발생한 부종양성 지방층염	Acute myeloid Leukemia ;  Paraneoplastic panniculitis
871	결핵성 추체염 1례 = A Case of Tuberculous Petrositis	결핵 ;  추체염 ;  Tuberculosis ;  Petrous Bone
872	Familial Juvenile Hyperuricemic Nephropathy and Uromodulin Gene Mutation	Hyperuricemia ;  Uromodulin ;  Tamm-Horsfall protein ;  Mutation
873	한국형 출혈열과 합병된 임신 1례 = A Case of Pregnancy Complicated with Korean Hermorrhagic Fever	Korean hemorrhagic fever ;  Pregnancy
874	슬와동맥 포착증후군  :  13예 13 Cases = Popliteal Artery Entrapment Syndrome	슬와동맥 포획증후군 ;  간헐적 파행증 ;  Popliteal artery entrapment syndrome ;  Intermittent claudication
875	완치 판정 후 8개월째 제1상 IgM항체 역가가 감소하지 않았던 급성 Q열 증례 = A Case of Acute Q Fever and Hepatitis Followed by High Long-term Titers Indicative of an Undetermined Stage	Q fever ;  Acute ;  Acute hepatitis ;  Immunofluorescence assay
876	피질하혈관성치매에서 증가된 혈장 B형 나트륨이뇨펩티드 = Elevated Plasma B-type Natriuretic Peptide Levels in Patients with Subcortical Vascular Dementia	알츠하이머병 ;  피질하혈관성치매 ;  나트륨이뇨펩티드 ;  Alzheimer’s disease ;  Natriuretic peptide ;  Subcortical vascular dementia
877	급성 천식 발작의 합병증으로 발생한 자발성 종격동기종과 피하기종 = Spontaneous Pneumomediastinum and Subcutaneous Emphysema Complicated by Acute Exacerbation of Asthma	Bronchial asthma ;  Mediastinal emphysema ;  Subcutaneous emphysema
878	임신 중 발생된 심상성 천포창 = A Case of Pemphigus Vulgaris Developed During Pregnancy	천포창 ;  자가면역질환 ;  임신 ;  Pemphigus ;  Autoimmune diseases ;  Pregnancy
879	A Case Report of endotracheal Neurofibroma treated by repetitive flexible bronchoscopic cryotherapy = A Case Report of endotracheal Neurofibroma treated by repetitive flexible bronchoscopic cryotherapy	신경섬유종 ;  기관지 내시경 ;  냉동요법 ;  Neurofibroma ;  Bronchoscopy ;  Cryotherapy
880	엘러스-단로스 증후군에 발생한 자발성 신장동맥 박리 = Spontaneous renal artery dissection in Ehlers-Danlos syndrome	Ehlers-Danlos syndrome ;  Renal artery ;  Spontaneous dissection
881	월경성 기흉을 유발한 횡격막의 자궁내막증 = A Case of diaphragmatic endometriosis presenting with catamenial pneumothorax	월경성 기흉 ;  자궁내막증 ;  흉강경수술 Catamenial pneumothorax ;  Endometriosis ;  Thoracoscopic operation
882	크론병 환자에서 메살라진 투여 중 발생한 호산구 폐렴 1예 = Mesalazine-induced Eosinophilic Pneumonia in a Patient with Crohn`s Disease	Crohn`s disease ;  Eosinophilic pneumonia ;  Mesalazine
883	Case Reports : A Case of Primary Adrenal Gland Lymphoma	Lymphoma ;  Non-Hodgkin`s ;  Adrenal gland
884	질내 탈감작법으로 치유된 정액 아나필락시스 1 례 = Intravaginal desensitization in a woman with seminal fluid allergy	seminal fluid hypersensitivity ;  intravaginal desensitization
885	[P116] A case of sarcoidosis arising in an old burn scar = [P116] A case of sarcoidosis arising in an old burn scar	Sarcoidosis ;  Burn scar ;  Scar
886	폐출혈을 동반하지 않은 항사구체 기저막 항체질환 = A Case of Anti-Glomerular Basement Membrane Antibody Disease without Pulmonary Hemorrhage	Anti-glomerular basement membrane antibody disease ;  Crescent ;  Plasmapheresis ;  Corticosteroid
887	증례 : 호흡기 ; 쯔쯔가무시병에 의한 급성 무결석 담낭염과 동시 감염된 기관지 결핵 1예 = Pulmonology ; A case of acute acalculous cholecystitis in Tsutsugamushi disease with endobronchial tuberculosis co-infection	쯔쯔가무시병 ;  급성 무결석성 담낭염 ;  기관지 결핵 ;  Tsutsugamushi disease ;  Acalculous cholecystitis ;  Endobronchial tuberculosis ;  Leflunomide
888	CASE REPORT : Endoscopic Findings of Enteropathy-Associated T-Cell Lymphoma Type II: A Case Series = CASE REPORT : Endoscopic Findings of Enteropathy-Associated T-Cell Lymphoma Type II: A Case Series	Enteropathy-associated T-cell lymphoma type II ;  Gastrointestinal lymphoma ;  Endoscopy ;  Double-balloon enteroscopy
889	Articular loose body, Synovial Chondromatosis of the Temporomandibular Joint :	Synovial chondromatosis ;  TMJ ;  loose body
890	Dapsone으로 치료한 호산구성 농포성 모낭염 1예 = A Case of Eosinophilic PustularFolliculitis Treated with Dapsone	Eosinophilic pustular folliculitis ;  Dapsone
891	복부 방선균증의 임상 양상 및 치료에 대한 반응 = Clinical Features and Therapeutic Responses of Abdominal Actinomycosis	방선균증 ;  복부 ;  대장내시경 ;  Actinomycosis ;  Abdomen ;  Colonoscopy
892	경피 경정맥 간내 문맥전신성 단락술로 치료한 췌장의 동정맥 기형에 의한 간문맥 고혈압 = A Case of Portal Hypertension Caused by Pancreatic Arteriovenous Malformation Successful Treatment with Transjugular Intrahepatic Portosystemic Shunt	Arteriovenous malformations ;  Pancreas ;  Hypertension ;  portal ;  Portosystemic shunt ;  transjugular intrahepatic
893	Analysis of clinical manifestation and prognosis of Korean patients with pulmonary alveolar proteinosis = Analysis of clinical manifestation and prognosis of Korean patients with pulmonary alveolar proteinosis	폐포단백증 ;  예후 ;  전폐세척술 ;  Pulmonary alveolar proteinosis ;  Prognosis ;  Whole lung lavage
894	Case Report : A Case of Elephantiasis Nostras Verrucosa	Cellulitis ;  Elephantiasis ;  Elephantiasis nostras verrucosa ;  Venous stasis
895	[P058] A case of eccrine poroma with syringofibroadenomalike features = [P058] A case of eccrine poroma with syringofibroadenomalike features	Eccrine poroma ;  Eccrine syringofibroadenoma ;  Bowen`s disease
896	Occurrence of multiple myeloma in the head and neck: a report of two cases	Multiple myeloma ;  Plasmacytoma ;  Plasma cell
897	증례 : 소화기 ; 식용 숯으로 인한 말단 회장에 발생한 탄분 침착증 = Case Reports : Gastroenterology ; Charcoal-induced anthracosis of the terminal ileum	Charcoal ;  Anthracosis ;  Terminal ileum ;  식용 숯 ;  탄분 침착증 ;  말단 회장
898	장기간 복막투석 중인 환자에서 발생한 루푸스장염 = A Case of Lupus Enteritis in a Patient Under Long-term Peritoneal Dialysis	Dialysis ;  Enteritis ;  End-stage renal disease ;  Lupus
899	[P059] A case of multicentric reticulohistiocytosis misdiagnosed as rheumatoid arthritis = [P059] A case of multicentric reticulohistiocytosis misdiagnosed as rheumatoid arthritis	Multicentric reticulohistiocytosis ;  Rheumatoid arthritis
900	급성 자율 감각 신경병증 1례 = A case of Acute Autonomic and Sensory Neuropathy	Acute autonomic and sensory neuropathy ;  Immunological damage
901	경련과 의식소실을 주소로 내원한 Estein-Barr 바이러스 연관성 혈구탐식성 림프조직구증 1례 = A Case of EBV-associated Hemophagocytic Lymphohistiocytosis with Seizure and Loss of Consciousness	Epstein-Barr virus ;  Hemophagocytic lymphohistiocytosis ;  Seizure ;  Cen-tral nervous system ;  Etoposide
902	[P083] Elastic perforans serpiginosa in pseudoxanthoma elasticum = [P083] Elastic perforans serpiginosa in pseudoxanthoma elasticum	Elastic perforans serpiginosa ;  Pseudoxanthoma elasticum
903	귀에 발생한 가성낭종의 수술 후 실리콘 자석 압박 치료 사례 1예 = A Case of Postoperative Silicone Magnet Compression Treatment of Pseudocyst in the Ear	Pseudocyst ;  External ear ;  Ear cartilage ;  Compression&#8901 ;  Magnets
904	Cutaneous mastocytosis in Korean patients : a clinical features of 77 cases = Cutaneous mastocytosis in Korean patients : a clinical features of 77 cases	Mastocytosis ;  Mast cell ;  Urticaria pigmentosa ;  Mastocytoma ;  Telangiectasia macularis eruptive perstans
905	Synovial Chondromatosis of the Temporomandibular Joint = A Case Report	Chondromatosis ;  synovial ;  Temporomandibular joint
906	알코올성 간경변 환자에서 다량의 복수로 발현된 막증식성 사구체신염의 양상을 동반한 IgA 신병증 = A Case of IgA Nephropathy with a Membranoproliferative Glomerulonephritis-Like Pattern Presenting as Massive Ascites in a Patient with Alcoholic Liver Disease	IgA nephropathy ;  Membranoproliferative glomerulonephritis ;  Ascites ;  Alcoholic Liver disease
907	Compound heterozygous mutations of ACADS gene in newborn with short chain acyl-CoA dehydrogenase deficiency: case report and literatures review	Acyl CoA dehydrogenase ;  Neonatal screening ;  Infant
908	성대에 발생한 단발성 신경섬유종 1예 = A Case of Isolated neurofibroma arising from the Vocal Cord	신경섬유종 ;  성대 ;  Neurofibroma ;  Vocal cord
909	Recurrent macrophage activation syndrome since toddler age in an adolescent boy with HLA B27 positive juvenile ankylosing spondylitis	Macrophage activation syndrome ;  Ankylosing spondylitis ;  HLA-B27
910	피부에서 발생한 골외성 Ewing 육종 = Cutaneous Extraskeletal Ewing`s Sarcoma	Cutaneous ;  Extraskeletal Ewing`s sarcoma
911	Case Report : Solitary Primary Gastric Mantle Cell Lymphoma = Case Report : Solitary Primary Gastric Mantle Cell Lymphoma	Mantle cell Lymphoma ;  Stomach ;  Primary ;  Solitary ;  Cyclin D1 positive
912	종괴로 발현된 결절형 근육 유육종증 = Muscle Mass in the Calf as a Presenting Symptom of Sarcoidosis	Muscular sarcoidosis ;  Nodular type
913	산전진단된 Infantile Polycystic Kidney 1례 = A Case of Prenatal Diagnosed Polycystic Kidney	영아 다낭성 신장 질환 ;  Infantile polycystic kidney disease
914	추체외로 증상이 추가적으로 발생한 알츠하이머치매 환자 = A Patient with Alzheimer’s Dementia Occurring Additional Extrapyramidal Tract Symptoms	Alzheimer’s dementia ;  Extrapyramidal symptoms ;  Parkinson’s disease ;  Molecular imaging
915	일차성 쇼그렌 증후군에 동반된 단백 소실 장병증 = A Case of Primary Sjogren`s Syndrome with Protein-Losing Enteropathy	Sjogren`s syndrome ;  Protein-Losing enteropathy ;  Prednisolone
916	베체트병 환자에서 발생한 Azathioprine에 의한 재발성 급성 췌장염 = A Case of Azathioprine Induced Recurrent Acute Pancreatitis in a Patient with Behcet`s Disease	Acute pancreatitis ;  Azathioprine ;  Behcet`s disease
917	부신종양의 임상적 고찰 = Clinical Analysis of Adrenal Tumors	부신종양 ;  쿠싱증후군 ;  원발성 알도스테로니즘 ;  갈색세포종 ;  Adrenal tumor ;  Cushing's syndrome ;  Primary aldosteronism ;  Pheochromocytoma
