	research_title	research_subject
1568	류마티스 관절염 환자에서 임신 중 발생한 괴저고름피부증 = Pyoderma Gangrenosum in a Patient with Rheumatoid Arthritis Developed during Pregnancy	Pyoderma Gangrenosum ;  Rheumatoid Arthritis ;  Pregnancy
1569	증례 : 알레르기 ; 서혜부에 재발한 기무라씨 병 1예 = Case Reports : Allergy ; A Case of Recurrent Kimura Disease in the Groin Area	기무라씨 병 ;  서혜부 ;  재발 ;  Kimura disease ;  Groin ;  Recurrence
1570	젊은 여자환자에서 발생한 특발성 칼슘 피로 인산염 침착질환 = 증례보고	Idiopathic Calcium Pyrophosphate Dihydrate(CPPD) crystal deposition disease ;  Chondrocalcinosis ;  Young female ;  특발성 칼슘 피로 인산염 침착질환 ;  연골석회화증 ;  젊은 여성
1571	만성 호중구성 백혈병 1예 = A Case of Chronic Neutrophilic Leukemia	Chronic neutrophilic leukemia ;  Neutrophilic leukocytosis ;  Absence of philadelphia chromosome ;  Alpha-2b-interferon
1572	콩에서 발생하는 강낭콩일반모자이크바이러스(BCMV)와 땅콩위축바이러스(PSV)의 저항성 평가 = Resistance Screening of BCMV and PSV in Soybean	Soybean (Glycine max L.) ;  virus ;  resistance screen ;  BCMV ;  PSV
1573	흉선종과 동반된 전신성 홍반성 루푸스 = Systemic Lupus Erythematosus and Thymoma -A Case Report-	Systemic Lupus erythematosus ;  Thymoma ;  Thymectomy
1574	이하선에 발생한 아구양 외투세포 림프종 1예 = A Case of Blastoid Mantle Cell Lymphoma Occurring in the Parotid Gland	Mantle cell lymphoma ;  Parotid gland ;  Blastoid variant
1575	[P399] Acrokeratosis paraneoplastica preceding the diagnosis of genital squamous cell carcinoma = [P399] Acrokeratosis paraneoplastica preceding the diagnosis of genital squamous cell carcinoma	Acrokeratosis paraneoplastica ;  Bazex syndrome ;  Genital squamous cell carcinoma ;  Squamous cell carcinoma
1576	상악동 점막탈출증 : 상악동 점액낭종의 변형 = Prolapsed Antral Mucosa : Variant of Maxillary Sinus Mucocele	Prolapsed antral mucosa(PAM) ;  Maxillary sinus mucocele
1577	뇌농양 24예에 대한 임상적 고찰 = Experience with 24 Consecutive Cases of Brain Abscess	Brain abscess ;  Catheter drainage ;  Pulmonary suppuration ;  Otogenic disease ;  Frontal sinusitis ;  Congenital heart disease
1578	신증후군을 동반한 다낭종신 1예 보고 = A Case of Adult Polycystic Kidney Disease Presented with Nephrotic Syndrome	APCK ;  Proteinuria ;  Nephrotic syndrome
1579	증례 : 내분비-대사 ; 아급성 갑상선염 후 발병된 그레이브스병 1예 = Case Reports : Endocrinology-metabolism ; A Case of Graves` Disease Following Subacute Thyroiditis	아급성 갑상선염 ;  그레이브스병 ;  Thyroiditis ;  subacute ;  graves` disease
1580	캐슬만병에서 기원하여 무증상 복강 내 종양으로 발현된 여포성 수상돌기 세포육종 = CA SE REPORT : Transformation of Castleman`s Disease into Follicular Dendritic Cell Sarcoma, Presenting as an Asymptomatic Intra-abdominal Mass	Follicular dendritic cell sarcoma ;  Castleman`s disease
1581	증례 : 위와 대장을 동시에 침범한 장결핵 = Case Report : A Case of Synchronous Intestinal Tuberculosis Involving the Stomach and Colon	Colon ;  Intestinal tuberculosis ;  Synchronous ;  Stomach
1582	레이노 현상에 의한 수지 괴사로 진단된 원발쓸개관간경화 = The Primary Biliary Cirrhosis Presenting with Raynaud`s Disease and Digital Necrosis	Primary biliary cirrhosis ;  Undifferentiated connective tissue disease ;  Raynaud`s phenomenon ;  Necrosis ;  Fingers ;  Diabetes mellitus
1583	Case Reports : Acral Angioosteoma Cutis = Case Reports : Acral Angioosteoma Cutis	Acral angioosteoma cutis ;  Pyogenic granuloma
1584	한국인 선IgA물집피부병의 임상연구 = Clinical Study of Korean Patients with Linear IgA Bullous Dermatosis한국인 선IgA물집피부병의 임상연구	Linear IgA bullous dermatosis ;  Chronic bullous disease of childhood
1585	전염병관련피해에 대한 법적 구제제도 = Legal Remedies for the victims of contagious disease	감염병 ;  구제역 ;  조류독감 ;  살처분 ;  예방접종 ;  백신피해보상제 연안정비사업 ;  Infectious Disease ;  Foot and Mouth ;  Avian Influenza ;  Slaughter ;  Vaccination ;  Vaccination Injury Compensation Program
1586	괴저고름피부증에 대한 임상적 고찰 = Pyoderma Gangrenosum: A Clinical Study괴저고름피부증에 대한 임상적 고찰	Clinical features ;  Pyoderma gangrenosum
1587	백반증환자의 임상양상 및 자가항체에 대한 고찰 = It ` s Clinical Analysis and Autoantibodies백반증환자의 임상양상 및 자가항체에 대한 고찰	Vitiligo ;  Autoantibody
1588	증례 : Kikuchi 병과 동반된 전신성 홍반성 루푸스 1예 = Case Reports : A case of systemic Lupus erythematosus associated with Kikuchi`s disease	경부 림프절 종대 ;  Kikuchi 병 ;  Cervical Lymphadenopathy ;  Kikuchi`s disease ;  SLE
1589	다낭종신과 동반된 I형 담관낭종 1예 = Type I Choledochal Cyst Combined with Polycystic Kidney Disease	총담관낭 ;  다낭종신 ;  다낭간 ;  담도암 ;  Choledochal cyst ;  Polycystic kidney disease ;  Polycystic liver disease ;  Cholangiocarcinoma
1590	이하선 종괴로 발현된 악성 림프종 = Parotid Mass as First Presentation of Malignant Lymphoma	Parotid mass ;  Primary malignant lymphoma
1591	Paget 병에서 발생한 발견하지 못한 불완전 스트레스 골절 -1예 보고- = Case Report : Undetected Incomplete Stress Fracture in the Proximal Femur of a Patient with Paget`s Disease -A Case Report-	Paget 병 ;  불완전 스트레스 골절 ;  근위 대퇴골 ;  Paget disease ;  Incomplete stress fracture ;  Proximal femur
1592	건강검진을 받은 대상에서 만성 신질환의 빈도와 관련 이상 = The Prevalence and the Associated Disorders of Chronic Kidney Disease in Subjects with Health Check-Up건강검진을 받은 대상에서 만성 신질환의 빈도와 관련 이상	Chronic renal insufficiency ;  Health care ;  Prevalence
1593	외이도 악성 종양 21례의 치료 경험 = Experience with the Malignancies of the External Auditory Canal: 21 cases	External auditory canal ;  Temporal bone resection ;  Postoperative radiotherapy
1594	증례 : 류마티스 ; 급성 열성 간염 형태로 나타난 성인형 스틸병 1예 = Case Reports : Rheumatology ; A Case of Adult Onset Still`s Disease Presented with Acute Febrile Hepatitis	간염 ;  성인형 스틸병 ;  Hepatitis ;  Adult-onset Still`s disease
1595	증예(症例) : 메티마졸 복용 중인 그레이브스병 환자에서 무과립구증과 급성 충수돌기염이 병발한 1예 = Case Reports : A case of methimazole induced agranulocytosis combined with acute appendicitis in a patient with Graves` disease	methimazole ;  agranulocytosis ;  acute appendicitis
1596	간질성 폐섬유화증을 동반한 전신형 결절성 다발동맥염 = Polyarteritis Nodosa Associated with Interstitial Pulmonary Fibrosis	Interstitial pulmonary fibrosis ;  Polyarteritis nodosa
1597	급성 A형 간염 환자에서 동반된 IgA 신병증 1예 = Case Report : A Case of IgA Nephropathy associated with Acute Hepatitis A	Glomerulonephritis IGA ;  Hepatitis A ;  Kidney failure acute ;  Proteinuria
1598	[P292] A case of human otoacariasis by Haemaphysalis longicornis = [P292] A case of human otoacariasis by Haemaphysalis longicornis	Otoacariasis ;  Haemaphysalis longicornis ;  Mite
1599	개화성 골 이형성증 : 3 case report = Florid osseous dysplasia : 3 case report	FOD ;  Fibro-osseous lesion
1600	Case Reports : Wells` Syndrome Associated with Churg-Strauss Syndrome = Case Reports : Wells` Syndrome Associated with Churg-Strauss Syndrome	Churg-Strauss syndrome ;  Flame figures ;  Wells` syndrome
1601	쯔쯔가무시병 환자에서 발생한 급성 결석성 담낭염 = Acute Calculous Cholecystitis in a Patient with Scrub Typhus	Scrub typhus ;  Acute calculous cholecystitis
1602	증례 : 류마티스 ; 다운증후군 환자에서 병발한 재발성 다발연골염과 괴저성 농피증 1예 = Case Reports : Rheumatology ; A case of relapsing polychondritis and pyoderma gangrenosum in a patient with Down`s syndrome	재발성 다발연골염 ;  괴저성 농피증 ;  다운증후군 ;  Relapsing polychondritis ;  Pyoderma gangrenosum ;  Down`s syndrome
1603	증례 : 두 종류의 항체를 보유한 자가면역성 저혈당 1예 = Case Report : A Case of Autoimmune Hypoglycemia in the Presence of Both Anti-insulin and Anti-insulin Receptor Antibodies	Cyclophosphamide ;  Insulin autoimmune syndrome ;  IAS ;  Type B insulin resistance
1604	가정간호 서비스내용 및 만족도에 대한 조사연구 = A Study on Home Health Care Service and the Level of Client Satisfaction	가정간호서비스 ;  만족도
1605	ODA and GAIN: The Key to Promoting Innovation	Antibiotic ;  Antibiotic-Resistance ;  ODA ;  GAIN ;  FDA ;  Pharmaceutical Industry
1606	증례 : 급성 폐렴으로 발현한 Mycobacterium intracellulare 폐질환 = Case Reports : Acute pneumonia caused by mycobacterium intracellulare	Mycobacterium avium complex ;  Mycobacterium avium-intracelluare infection ;  Mycobacterium avium-intracelluare 감염증 ;  폐렴 ;  Pneumonia
1607	소아의 경부 종괴에 관한 임상 및 병리학적 고찰 = Clinical and Pathological Evaluation of Neck Masses in Children	Pediatric ;  Neck mass ;  Lymph node
1608	혈전증이 의심되는 환자에서 혈액응고 인자 V Leiden(1691G→A) 돌연변이의 빈도 = The Prevalence of Leiden(1691G→A) Mutation in the Factor V Gene in Korean Patients suspected to Have Thrombosis	Factor V Leiden ;  APC resistance ;  Thrombosis ;  Korean
1609	고관절의 수지상 지방종 -1예 보고- = Case Report : Lipoma Arborescens in the Hip Joint -A Case Report-	수지상 지방종 ;  고관절 ;  Lipoma arborescens ;  Lipoma
1610	"""삼국사기(三國史記)""에 기록된 의약내용(醫藥內容) 분석 = Study on Medical Records In ${\ulcorner}$the Historical Records of the Three Kingdoms${\lrcorner}$"	the Historical Records of the Three Kingdoms ;  Plague ;  Drugs ;  the Medical System ;  Spa ;  Acupuncture
1611	『三國史記』에 기록된 醫藥內容 분석 = Study on Medical Record in 『the Historical Records of the Three Kingdoms』	the Historical Records of the Three Kingdoms ;  Plague ;  Drugs ;  the Medical System ;  Spa ;  Acupuncture
1612	가정용 인공호흡기를 적용한 희귀·난치성질환자를 돌보는 가족간호자의 부담감과 삶의 질 영향요인	Rare disease ;  Ventilator ;  Caregiver ;  Burden ;  Quality of life
1613	Primary hepatic neuroendocrine tumours of liver- a rarity: Single centre analysis of 13 patients	Rare liver tumours ;  NETs of liver ;  Primary NETs of liver
1614	Identification of Novel Gene Variants Leading to Skeletal Dysplasia	Rare genetic diseases ;  Skeletal dysplasia ;  TONSL ;  BMPR2 ;  Genome maintenance
1615	Shprintzen-Goldberg syndrome with a novel missense mutation of SKI in a 6-month-old boy	Rare disease ;  Marfan syndrome ;  Neurodevelopmental disorder ;  SKI
1616	내경정맥 혈전증을 동반한 중증 난소과자극증후군 = A Case of Internal Jugular Vein Thrombosis Associated with Severe Ovarian Hyperstimulation Syndrome	Ovarian hyperstimulation syndrome ;  Deep vein thrombosis ;  난소과자극증후군 ;  심부정맥혈전증
1617	양성질환으로 오인된 손톱주위에 편평세포암 2예 = Squamous Cell Carcinoma and Bowen Disease in Nail Apparatus	Bowen disease ;  Fingernail ;  Human papillomavirus ;  Squamous cell carcinoma
1618	영아형 알렉산더 병 1례 = A Case of Infantile Alexander Disease	Alexander disease ;  Infantile
1619	비전형 임상양상을 보인 부신 결핵 1 예 = A Case of Adrenal Tuberculosis with Atypical Clinical Mani- festation	Addison’s disease ;  Adrenal tuberculosis
1620	전격성 간염으로 발병된 Wilson 간염 = A Case of Wilson`s Disase Presenting with Fulminant Hepatitis	Wilson`s disease ;  Hepatitis Fulminant ;  Transplantation Liver
1621	파킨슨병 환자의 뇌에서 전기영동시 서행하는 α - Synuclein 발견 = Slowly - Migrating α - Synuclein Forms Are Found in the Brains of Patients with Parkinsons Disease	Parkinsons disease ;  pathogenesis ;  α - synuclein ;  slowly - migrating forms
1622	CASE REPORT : Empyema caused by Clostridium perfringens = CASE REPORT : Empyema caused by Clostridium perfringens	Empyema ;  Clostridium perfringens
1623	장기간 발열을 보인 아급성 괴사성 임파선염의 임상적 연구 = Kikuchi-Fujimoto Disease with Prolonged Fever in Children	Kihuchi-Fujimoto disease ;  Subacute necrotizing lymphadenitis ;  Prednisolone
1624	Propylthiouracil에 의한 약제 유발 루푸스 = A Case of Propylthiouracil-Induced Lupus	Graves` disease ;  Drug-induced Lupus ;  Propylthiouracil
1625	흉추부에 발생한 고립성 골수증  :  증례보고 = A Case of Solitary Myeloma in Thoracic Spine	Soliary myeloma ;  Plasmacytoma ;  Thoracic spine ;  Surgery ;  Radiation therapy
1626	골반 및 복부 방선규증 1 예 = A Case of Pelvic and Abdominal Actinomycosis Associated with wearing an Intrauterine Device	방선균증 ;  자궁내 피임장치 ;  가성종양 ;  Actinomycosis ;  IUD ;  Pelvic and abdominal mass
1627	임신중 출혈을 유발한 Moyamoya병  :  증례보고 Case Report = A Case of Moyamoya Disease with Intracranial Hemorrage in Pregnancy	Moyamoya disease ;  Pregnancy ;  Intracranial hemorrhage
1628	고령의 뇌동맥류성 지주막하출혈 환자에서 수술에 따른 임상적 고찰 = Clinical Analysis of Operation for Elderly Patients with Cerebral Aneurysmal Subarachnoid Hemorrhage	Cerebral aneurysm ;  Elderly ;  Surgical outcome
1629	8, 9번 삼염색체를 가진 골수형성이상증후군과 정신분열증을 동반한 베체트병 = A Case of Behcet`s Disease Associated with Schizophrenia and Myelodysplastic Syndrome with Trisomy 8 and 9	Behcet`s disease ;  Myelodysplastic syndrome ;  Schizophrenia
1630	Kennedy병에 의한 개방성 이관 1예 = A Case of Patulous Eustachian Tube Associated with Kennedy Disease	Kennedy disease ;  Spinobulbar muscular atrophy ;  Eustachian tube
1631	증례 : 내분비-대사 ; ABCA1 유전자의 새로운 돌연변이로 인한 Tangier병 1예 = Case Reports : Endocrinology-metabolism ; A case of Tangier disease with two novel mutations in the ATP-binding cassette transporter A1 gene	Tangier Disease ;  ATP binding cassette transporter 1 ;  Cholesterol ;  HDL ;  Corneal opacity ;  Tangier병 ;  ABCA1 ;  고밀도지질단백질 ;  각막혼탁
1632	다발성 동맥류와 혈전증을 동반한 베체트병 1예 = Multiple Arterial Aneurysms and Thrombosis in Behcet's Disease	베체트병 ;  혈관염 ;  Behcet's disease ;  Vasculitis.
1633	하지에 발생한 Woringer-Kolopp 병 = A Case of Woringer-Kolopp Disease on the Leg	Cutaneous Lymphoma ;  Pagetoid reticulosis ;  Woringer-Kolopp disease
1634	가족내 발생한 선천성 대장 항문 기형증 = Congenital Coloanal Malformations Developed in a Family	Hirschsprung's Disease ;  Aganglionosis ;  Imperforate Anus
1635	Trevor 병; 편측성 골단 이형성증 - 증례 보고 - = Trevor's Disease; Dysplasia Epiphysealis Hemimelica - A Case Report -	슬관절 ;  편측성 골단 이형성증 ;  자기공명영상
1636	COL6A1 돌연변이에 의해 발생한 산발성 Ullrich 병 1례 = A Case of Sporadic Ullrich Congenital Muscular Dystrophy Caused by a COL6A1 Mutation	Ullrich disease ;  Collagen VI ;  COL6A Address for
1637	Contrast-Induced Encephalopathy after Coil Embolization: A Case Report and Review of Literature	Brain diseases ;  Contrast media ;  Encephalomalacia ;  Status epilepticus
1638	Hallervorden-Spatz 병 환자의 전신마취 하 치과치료 -증례보고- = Dental Treatment of a Patient with Hallervorden-Spatz Disease under General Anesthesia -A Case Report-	Dental treatment ;  Dystonia ;  General anesthesia ;  Hallervorden-Spatz disease
1639	Clinical Features and Prognosis of Pediatric Graves’ Orbitopathy in Korea	Graves disease ;  Graves ophthalmopathy ;  Pediatric
1640	베체트병 환자에서 발생한 신증후군 양상을 보인 면역글로불린 A 신증 = Case Report : A Case of Immunoglobulin A Nephropathy with Nephrotic Syndrome in a Patient with Behcet`s Disease	Nephrotic syndrome ;  Behcet`s disease ;  IgA nephropathy
1641	방사선치료 후 발생한 간소정맥 폐쇄질환 -3예 보고- = Hepatic Veno-occlusive Disease Developed after Irradiation -A report of three cases-	Venoocclusive disease ;  Irradiation ;  Liver
1642	습관성 흡연여성에서 후측 수부에 발생한 Buerger씨병 = Buerger's Disease in Female Habitual Smoker with Involvement of the Right Hand	Buerger's disease ;  Female
1643	비강과 타액선에서 발생한 Rosai-Dorfman병 1 예 = The Rosai-Dorfman Disease of th Nasal Cavity and Salivary Gland : A Case Report	Rosai-Dorfman병 ;  비강 ;  타액선 ;  Rosai-Dorfman disease ;  Nasal cavity ;  Salivary gland
1644	베체트병 환자에서 발생한 횡단 척수염 = Transverse Myelitis in Patient with Behcet`s Disease	Behcet`s disease ;  Transverse myelitis
1645	증례 : 쓰나미 피해지역 의료봉사 후 집단 발병한 뎅기열 3예 = Case Reports : Three cases of dengue fever among the medical relief team serving in the tsunami region	Dengue ;  Disease outbreak ;  Tsunami ;  뎅기열 ;  집단발병 ;  쓰나미
1646	종격동에 발생한 Castleman병 1례 보고 = A Case of the Castleman`s Disease in the Mediastinum	Castleman's disease ;  Lymph node hyperplasia ;  Mediastinum
1647	점액표피양 암종과 동반된 경부 캐슬만 병 1예 = Synchronous Mucoepidermoid Carcinoma of Parotid Gland and Unicentric Cervical Cathleman’s Disease : A Case Report	Castleman’s disease ;  Mucoepidermoid Tumor ;  Parotid neoplasm ;  캐슬만 병 ;  점액표피양 암종 ;  이하선 신생물.
1648	비강과 타액선에서 발생한 Rosai-Dorfman 질환 -1예 보고- = Rosai-Dorfman Disease of the Nose and Salivary Gland	Rosai-Dofman disease ;  Nose ;  Salivary gland ;  Inflammatory pseudotumor
1649	내시경 검사에서 점액교를 보인 Menetrier 병 = A Case of Menetrier`s Disease Showing Mucus Bridge Observed during Endoscopy	Menetrier`s disease ;  Mucus ;  Endoscopy
1650	양측성 돌발성 난청이 병발한 쯔쯔가무시병 = Tsutsugamushi Disease and Acute Bilateral Hearing Loss	Scrub typhus ;  Sensorineural hearing loss ;  Tsutsugamushi disease
1651	전신성 홍반성 루푸스와 병발한 Kikuchi병(조직구성 괴사성 림프선염) = A Case of Kikuchi`s Histiocytic Necrotizing Lymphadenitis Associated with Systemic Lupus Erythemasus	Kikuchi`s disease ;  Systemic Lupus erythematosus
1652	Kikuchi병 후에 발생한 심재홍반루푸스 = Lupus Erythematosus Profundus Associated with Kikuchi`s Disease	Cutaneous Lupus erythematosus ;  Kikuchi`s disease ;  Lupus erythematosus profundus
1653	2010년 방류용 수산종묘에 대한 병원체 검출 = Detection of fish pathogens in cultured juveniles for stock enhancement in 2010	Hatchery-rared seed ;  Stock enhancement ;  Infectious disease ;  Inspection
1654	영아 연축을 동반한 멘케스병 1례 = A Case of Menkes disease with Infantile Spasm	Menkes disease ;  Infantile spasm ;  ATP7A mutation
1655	Detection of Helicobacter heilmannii Infection in a Cat	Gastroenteric disease ;  Helicobacter ;  cat ;  feline ;  Persian
1656	멘케스 병 환아의 3년 추적관찰 = 3-year Follow-up of a Menkes Disease Patient	Menkes disease ;  Copper ;  ATP7A mutations
1657	A Family Harboring CMT1A Duplication and HNPP Deletion	Charcot-Marie-Tooth disease ;  HNPP ;  PMP22
1658	다발성 몬도씨병 1예 = A Case of Multiple Mondor's Disease	Mondor's disease ;  Multiple
1659	간내 원발 낭종 파열에 의해 발생한 다발 복강 내 포충낭종 1예 = A Case of Multiple Intraperitoneal Cysts from Ruptured Hepatic Hydatid Cysts	Hydatid cyst ;  Echinococcal cyst
1660	거대 종괴 형태로 나타난 유방의 가성혈관양 간질 증식  :  1예 보고 A Case Report = Pseudoangiomatous Stromal Hyperplasia of the Breast Appearing as a Giant Mass	Breast ;  diseases ;  Breast neoplasms ;  diagnosis
1661	2세 여아에서 성장 부진과 다리 통증을 동반한 1형 고셔병 증례 = A Case of a 2-year-old Girl with Type I Gaucher Disease Presenting with Growth Retardation and Leg Pain	Gaucher disease ;  GBA ;  Growth ;  Bone pain ;  Enzyme replacement therapy
1662	혈액 투석중인 상염색체 우성 다낭성 신질환에서 발생된 요흉 1 예 = A Case of Urinothorax in Autosomal Dominant Polycystic Kidney Disease Hemodialyzed	Urinothorax ;  ADPKD ;  Hemodialysis
1663	혈액투석 중인 말기신부전 환자에서 발생한 양측 신장의 자발성 파열 = Spontaneous Bilateral Renal Rupture in an End-stage Renal Disease Patient Treated with Hemodialysis	Cystic kidney disease ;  Spontaneous rupture ;  Hemodialysis
1664	한국인에서 크론병과 Toll-Like Receptor 유전자의 연관성 = Association of Toll-Like Receptor Gene with Crohn`s Disease in Koreans	Crohn`s disease ;  Toll-Like receptor ;  Korea ;  크론병 ;  한국
1665	SPECT상 이상소견을 보인 Marchiafava-Bignami 병 1예 = A Case of Marchiafava-Bignami Disease with Abnormal SPECT Findings	Marchiafa-Bignami disease ;  Corpus callosum ;  Demyelination ;  MRI ;  SPECT
1666	당원축적병에서 발생한 간세포암 1 예 = A Case of Hepatocellular Carcinoma Developed in Type 1Glycogen Storage Disease	Glycogen storage disease ;  Hepatic adenoma ;  Hepatocellular carcinoma
1667	정상면역을 가진 성인에서 발생한 식도 방선균증 = A Case of Esophageal Actinomycosis in a Patient with Normal Immunity	Actinomycosis ;  Esophageal diseases ;  Immunocompetence
1668	신생아에서 담석을 동반한 Anti-E 항체에 의한 동종 면역성 용혈성 질환 1례 = A Case of Gallbladder Stones Associated with Anti-E Antibody Hemolytic Disease in a Neonate	Cholelithiasis ;  Neonate ;  Hemolytic disease of the newborn ;  Anti-E antibody
1669	무통성 결절 양상의 갑상선에 발생한 만성 육아종성 염증 1예 = A Case of Chronic Granulomatous Inflammation of Thyroid Gland Presenting as a Painless Thyroid Nodule	Chronic granulomatous inflammation ;  Thyroid gland ;  만성 육아종성 염증 ;  갑상샘.
1670	국한형 다리에 병 = A Case of Localized Darier`s Disease	Localized Darier`s disease ;  Darier`s disease
1671	측두하악관절 퇴행성관절질환을 동반한 전치부개교환자의 측모두부방사선계측학적 연구 = CEPHALOMETRIC APPRAISAL OF THE OPEN-BITE CASES WITH THE DEGENERATIVE JOINT DISEASE OF THE TEMPOROMANDIBULAR JOINT	퇴행성관절질환 ;  측두하악관절 ;  측모두부방사선계측학 ;  개교 ;  Degenerative joint disease ;  Temporomandibular joint ;  Cephalometics ;  Open-bite
1672	경계성 점액성 난소종양 수술 후 나타난 피부근염 환자에서 발견된 대장암 (피부근염환자에서 동시에 나타난 난소종괴와 대장암 ) = A Case of Ovarian Mucinous Borderline tumor in Postoperatively Diagnosed Dermatomyositis accompanying Colon Cancer	피부근염 ;  경계성 난소암 ;  Borderline tumor ;  Dermatomyositis ;  Ovarian tumor
1673	한국인 제3형 당원병 환자의 임상상 및 AGL 유전자형 = AGL gene mutation and clinical features in Korean patients with glycogen storage disease type III	Glycogen storage disease ;  Glycogen storage disease type III ;  AGLgene ;  Glycogen debranching enzyme
1674	Effect of Agrimonia pilosa Ledeb extract on DSS-induced ulcerative colitis in mice	Inflammatory bowel disease ;  Agrimonia Pilosa Ledeb ;  Ulcerative colitis ;  Anti-inflammatory effect
1675	바이러스성 심근염 환자에서 발현한 다발성 뇌경색 1예 = A Case of Multiple Cerebral Infarctions Following Viral Myocarditis	KEY WORDS: Viral myocarditis·Cardiogenic embolism. ;  KEY WORDS: Viral myocarditis·Cardiogenic embolism.
1676	혈액투석 중인 다낭신 환자에서 발생한 간낭종 파열 = Hepatic Cyst Rupture in a Hemodialysis Patient with	Polycystic kidney disease ;  Cyst ;  Rupture ;  Hemodialysis
1677	Prevalence of Anti-deamidated Gliadin Peptide Antibodies in Asian Patients With Irritable Bowel Syndrome = Prevalence of Anti-deamidated Gliadin Peptide Antibodies in Asian Patients With Irritable Bowel Syndrome	Asian ;  Celiac disease ;  Gliadin ;  Gluten sensitive enteropathy ;  Irritable bowel syndrome
1678	Long lasting mesalazine-induced pancytopenia in a patient with ulcerative colitis	Pancytopenia ;  5-aminosalicylic acid ;  Mesalazine ;  Ulcerative colitis
1679	피하 우회 인조혈관의 외상성 파열 1례 = Traumatic Rupture of the Subcutaneous Bypass Vascular Graft - A case report -	Arterial occlusive disease ;  Prosthetic vascular graft ;  Traumatic rupture
1680	자궁 내 장치와 연관된 골반 및 복부 방선균증 = A Case of Pelvic and Abdominal Actinomycosis Associated with Wearing an Intrauterine Device	Actinomycosis ;  Intrauterine device ;  IUD ;  방선균증 ;  자궁 내 장치
1681	백혈구 감소증이 동반된 성인형 스틸병 = A Case of Adult-onset Still`s Disease Associated with Leukopenia	Adult-onset Still`s disease ;  Leukopenia
1682	다발성 경화증의 임상양상으로 내원한 전신홍반루푸스 2예 = Demyelinating Syndrome Resembling Multiple Sclerosis as the First Manifestation of Systemic Lupus Erythematosus Report of Two Cases	Multiple sclerosis ;  Systemic Lupus erythematosus ;  Demyelinating syndrome
1683	식도암 진단 후 발생한 경피증 = A Case of Scleroderma Preceded by Esophageal Carcinoma	Esophageal cancer ;  Scleroderma
